id,filename,subCategory,query
28808,28808.jpg,Topwear,Denizen Men Striped Black Shirt Black
43539,43539.jpg,Topwear,French Connection Women Multicoloured Striped Top White
13249,13249.jpg,Bottomwear,Palm Tree Kids Boy Solid Brown Trousers Brown
19773,19773.jpg,Bottomwear,United Colors of Benetton Women Grey Striped Tights Grey
46877,46877.jpg,Socks,Lino Perros Men Pack of 2 Socks Beige
31119,31119.jpg,Topwear,Gini and Jony Girls Purple Top Purple
8324,8324.jpg,Topwear,Doodle Boy's Athletic 77 Dept White Kidswear White
28034,28034.jpg,Innerwear,Jockey ELANCE Men Charcoal Grey Y Front Briefs 1006 Charcoal
47199,47199.jpg,Shoes,Franco Leone Men Dark Brown Formal Shoes Brown
27840,27840.jpg,Belts,Bulchee Men Red Leather Belt Red
26992,26992.jpg,Bottomwear,Jealous 21 Women Washed Light Blue Jeans Blue
31925,31925.jpg,Bags,Fabindia Women Red Silk Handbag Red
18493,18493.jpg,Sandal,Puma Men Duncan Multi Slipper Multi
8116,8116.jpg,Watches,Fastrack Men Analog Steel Navy Blue Watch Navy Blue
7962,7962.jpg,Topwear,Puma Men's Graphic Black Red T-shirt Black
19541,19541.jpg,Gloves,United Colors of Benetton Men Solid Black Gloves Black
13847,13847.jpg,Topwear,United Colors of Benetton Women Printed White Top White
16509,16509.jpg,Bottomwear,Locomotive Men Washed Blue Jeans Blue
12995,12995.jpg,Shoes,Timberland Kids Boys Brown Casual Shoes Synthetic Brown
46279,46279.jpg,Topwear,109F Women Blue & Green Polka Dot Print Tunic Blue
53599,53599.jpg,Free Gifts,Q&Q Men Black Digital Watch Black
58171,58171.jpg,Bags,Rocky S Women Grey Handbag Grey
5609,5609.jpg,Sandal,ADIDAS Men Receptor Navy Sports Sandals Navy Blue
21985,21985.jpg,Bags,Murcia Women Casual Brown Handbag Brown
39146,39146.jpg,Apparel Set,Aneri Women Purple Ombre Churidar Kurta & Dupatta Set Purple
57139,57139.jpg,Bottomwear,Elle Women Black Etra Slim Fit Trousers Black
16951,16951.jpg,Eyewear,Image Men Classic Eyewear Black Sunglasses Metal Black
49655,49655.jpg,Bottomwear,Mineral Pink & Green Skirt Pink
19125,19125.jpg,Flip Flops,Lotto Women XL Kelly Blue Slippers Blue
48787,48787.jpg,Jewellery,Lucera Women Silver Pendant Silver
17883,17883.jpg,Innerwear,Levis Men Comfort Style Navy Blue Innerwear Vest Navy Blue
2048,2048.jpg,Topwear,ADIDAS Men's Crew Black T-shirt Black
22358,22358.jpg,Topwear,John Players Men Solid Beige Shirt Beige
28662,28662.jpg,Shoes,Nike Men Lunar Flow Black Casual Shoes Black
50778,50778.jpg,Shoes,Clarks Men Navy Leather Sneakers Leather Navy Blue
2874,2874.jpg,Shoes,Catwalk Women Black Heels Black
33824,33824.jpg,Shoes,Puma Women Grey Axis Sports Shoes Grey
58515,58515.jpg,Topwear,Tonga Women White Top White
25941,25941.jpg,Scarves,Femella Women Yellow & Brown Scarf Yellow
45098,45098.jpg,Innerwear,Bwitch Fushia Pink Sapphire Brief Pink
33018,33018.jpg,Topwear,Mother Earth Women Striped Green Kurta Green
44976,44976.jpg,Watches,Maxima Attivo Men Black Dial Watch Black
11348,11348.jpg,Bottomwear,Lee Men Navy Blue Powell Fit Jeans Navy Blue
41438,41438.jpg,Shoes,Lee Cooper Men White Sports Shoes White
52813,52813.jpg,Wallets,JAG Men Chocolate Brown Leather Wallet Brown
39522,39522.jpg,Bags,Peter England Unisex Black Bag Black
44378,44378.jpg,Fragrance,ADIDAS Men Dynamic Pulse Perfume Black
58727,58727.jpg,Topwear,Puma Women Purple T-shirt Purple
14408,14408.jpg,Shoes,Enroute Women Casual Beige Flats Beige
11946,11946.jpg,Sandal,Ganuchi Men Casual Brown Sandals Brown
36758,36758.jpg,Watches,Maxima Women Grey Dial Watch Grey
5863,5863.jpg,Topwear,ADIDAS Men's Saltero Purple T-shirt Purple
39710,39710.jpg,Watches,ADIDAS Original Unisex Blue Dial Chronograph Watch ADH2639 Metal Blue
19317,19317.jpg,Bags,Nike Unisex Casual Black Backpack Black
55038,55038.jpg,Lips,Lakme Absolute Matte Brick Lipstick 51 Brown
8740,8740.jpg,Topwear,Indigo Nation Men Checks Navy Blue Shirt Navy Blue
23884,23884.jpg,Shoes,Fila Men Hitech White Sports Shoes White
9692,9692.jpg,Topwear,Classic Polo Men Ikon Navy Blue Polo Tshirts Navy Blue
27418,27418.jpg,Bottomwear,Jockey Women Red Relaxed Capris Red
34833,34833.jpg,Shoes,ADIDAS Women Sweep Green Sandals Green
7708,7708.jpg,Bottomwear,Jealous 21 Women Aliah Blue Jegging Blue
55804,55804.jpg,Loungewear and Nightwear,SDL by Sweet Dreams Women Multicoloured Striped Night Suit S11-3129 Multi
51498,51498.jpg,Bottomwear,Denizen Women Blue Jeans Blue
29582,29582.jpg,Shoes,Puma Women Black Grace Flats Black
28450,28450.jpg,Bottomwear,Urban Yoga Women Grey Track Pants Grey
4710,4710.jpg,Watches,ADIDAS Unisex New York Chronographic Digital Black Red Watch Black
15347,15347.jpg,Topwear,Nike Men Special Edition 3 Star Cricket Fan Black Tshirts Black
52480,52480.jpg,Loungewear and Nightwear,Red Rose Blue & Black Nightdress Blue
59068,59068.jpg,Innerwear,Peri Peri Women Blue Bra Blue
21172,21172.jpg,Topwear,s.Oliver Women Powder Blue Tunic Blue
40979,40979.jpg,Topwear,Gini and Jony Boys Core Yellow T-shirt Yellow
38863,38863.jpg,Topwear,Latin Quarters Women Blue Printed Top Blue
14295,14295.jpg,Topwear,Classic Polo Men Printed pack of 3 Tshirts Black
56020,56020.jpg,Lips,Colorbar Soft Touch Felin Lipstick 036 Purple
32565,32565.jpg,Topwear,ONLY Women Smock Blue Top Blue
40145,40145.jpg,Bottomwear,Gini and Jony Girls Kinky Pink Capris Pink
58986,58986.jpg,Fragrance,Cavallini Women Deo Magenta
24400,24400.jpg,Topwear,Vishudh Women Black Printed Kurta Black
10635,10635.jpg,Shoes,Carlton London Men Semi oxfords Black Casual Shoes Black
18458,18458.jpg,Fragrance,David Beckham Instinct Men Deos White
27285,27285.jpg,Topwear,Mother Earth Women Brown Kurta Brown
48328,48328.jpg,Bags,Pitaraa Women Pink Sling Bag Pink
42612,42612.jpg,Jewellery,Estelle Women Gold Earring & Pendant Set Gold
3535,3535.jpg,Topwear,Myntra Men's Saadhu Starter Kit Navy Blue T-shirt Navy Blue
26357,26357.jpg,Topwear,Arrow Woman Striped Pink T-shirt Pink
12162,12162.jpg,Bottomwear,Aurelia Women Solid Blue Leggings Green
47360,47360.jpg,Bags,Baggit Women Green Bag Green
9833,9833.jpg,Topwear,Little Miss Women Printed Olive Green T-shirt Green
17410,17410.jpg,Shoes,Lotto Men Atlantica White Sports Shoe White
23625,23625.jpg,Topwear,Doodle Kids Girls Pink Retro Top Pink
51205,51205.jpg,Innerwear,Enamor Women Skin Bra Skin
7195,7195.jpg,Topwear,Jealous 21 Women Knit Butterfly Print White Top White
30000,30000.jpg,Watches,Aspen Women Silver Dial Watch Silver
13282,13282.jpg,Bottomwear,Gini and Jony Kids Solid Black Capris Black
54545,54545.jpg,Bags,Lino Perros Women Orange Handbag Orange
55497,55497.jpg,Lips,Revlon Peony Pivoine Lip Gloss 008 Pink
12350,12350.jpg,Topwear,Reid & Taylor Men Pink Striped Shirt Pink
29911,29911.jpg,Watches,Police Men Black Dial Watch PL12176JS02A Leather Black
3707,3707.jpg,Topwear,Classic Polo Men's Purple Black & Cream Stripe T-shirt Purple
6275,6275.jpg,Topwear,UCB Women's Crystal Benetton Pink T-shirt Pink
26959,26959.jpg,Topwear,Jealous 21 Women Pink Shirt Pink
46080,46080.jpg,Shoes,ADIDAS Men Blue Sports Shoes Blue
51037,51037.jpg,Innerwear,Enamor Women White and Pink Briefs White
21340,21340.jpg,Eyewear,Pal Zileri Men Casual Copper Frame Sunglasses Copper
4522,4522.jpg,Shoes,Puma Men's Faas Grey Shoes Grey
45605,45605.jpg,Shoes,Arrow Men Black Formal Shoes Black
37225,37225.jpg,Bags,United Colors of Benetton Men Olive Duffle Bag Olive
53760,53760.jpg,Topwear,Puma Men Navy Blue and White T-shirt Navy Blue
15949,15949.jpg,Ties,Turtle Men Check Black Ties Black
32757,32757.jpg,Shoes,Fila Men Glam II Multi Coloured Shoes Multi
56212,56212.jpg,Jewellery,Estelle Women Gold Pendant with Chain Gold
24632,24632.jpg,Flip Flops,ADIDAS Unisex Red Checks Flip Flops Red
10407,10407.jpg,Topwear,United Colors of Benetton Men Solid Grey Shirts Grey
33685,33685.jpg,Shoes,Cobblerz Men Black Formal Shoes TPR Black
12734,12734.jpg,Bags,Nike Women Samba Black Handbags Black
42044,42044.jpg,Shoes,Nike Men Wardour Chukka White Casual Shoes Grey
3363,3363.jpg,Topwear,Myntra Women Creative designs Black T-shirt Black
9659,9659.jpg,Topwear,Indigo Nation Men Reversible Bling Blue Shirts Blue
30464,30464.jpg,Innerwear,Lovable Women All Day Long White Bra White
43196,43196.jpg,Watches,Fastrack Women White Dial Watch White
54121,54121.jpg,Shoes,Rocia Women Black Flats Black
35116,35116.jpg,Jewellery,Allen Solly Woman Black Necklace Black
42878,42878.jpg,Bags,Maroon
16394,16394.jpg,Topwear,Levis Men Check Blue  Shirts Blue
51453,51453.jpg,Topwear,Tonga Women Multicoloured Top Multi
50581,50581.jpg,Innerwear,Chromozome Men Grey Pack of 2 Briefs Grey Melange
17246,17246.jpg,Topwear,U.S. Polo Assn. Men Stripes Navy Blue Polo Tshirt Navy Blue
23073,23073.jpg,Bottomwear,Arrow Men Grey Trousers Grey
6611,6611.jpg,Topwear,Spykar Men Stripes Navy Blue Shirt Navy Blue
47536,47536.jpg,Shoes,Portia Women Black Flats Black
5094,5094.jpg,Topwear,Wrangler Men's Reverse Print Brown T-shirt Brown
15511,15511.jpg,Shoes,Rockport Women Jeanie Thong Chain Pink Flats Pink
21724,21724.jpg,Shoes,Catwalk Women Casual Brown Heels Brown
36793,36793.jpg,Watches,Maxima Attivo Men Off-White Dial Watch 24130LMGT Synthetic Off White
4146,4146.jpg,Shoes,Nike Women Trainer White Purple Shoe White
45261,45261.jpg,Watches,Casio G-SHOCK Men Black Dial Analogue & Digital Watch G220 Synthetic Red
24256,24256.jpg,Shoes,Numero Uno Men Green Casual Shoes Green
10063,10063.jpg,Topwear,Puma Men spine tee Yellow Tshirts Yellow
38609,38609.jpg,Topwear,Nike Men Printed Blue T-shirt Blue
32333,32333.jpg,Watches,Q&Q Men Black Dial Watch Synthetic Black
56676,56676.jpg,Watches,Maxima Men White Chronograph Watch White
25384,25384.jpg,Innerwear,Levis Men Blue Brief Blue
53136,53136.jpg,Shoes,Catwalk Women Black Heels Black
44181,44181.jpg,Fragrance,Nike Fragrances Women Free Soul Perfume 150 ml White
24858,24858.jpg,Topwear,Mark Taylor Men White Striped Shirt White
37473,37473.jpg,Watches,Esprit Men Black Watch Black
4374,4374.jpg,Topwear,Batman Men's Batman Big Face Black T-shirt Black
15723,15723.jpg,Shoes,Nike Women Ballista II White Sports Shoes White
40521,40521.jpg,Watches,Titan Men Cream Dial Watch Cream
57596,57596.jpg,Lips,Lotus Herbals Moistpetals Rose Lipstick 141 Rose
56444,56444.jpg,Nails,Streetwear Shine Divine Cherry Divine Nail Enamel 16 Red
11383,11383.jpg,Topwear,United Colors Of Benetton Women Light Winter Black Tops Black
42276,42276.jpg,Shoes,Vans Men Navy Blue Michoacan Shoes Navy Blue
3151,3151.jpg,Shoes,Nike Men's Lunarswift Blue Shoe Blue
31784,31784.jpg,Topwear,Lee Women Katie Red Top Red
26733,26733.jpg,Fragrance,Reebok Men Chennai Super Kings Deo Gold
12506,12506.jpg,Shoes,Red Tape Men Brown Shoes Brown
17848,17848.jpg,Topwear,Flying Machine Women Mind Your White Tshirt White
22393,22393.jpg,Topwear,ADIDAS Women Verve Tee Grey T-shirt Grey
51661,51661.jpg,Watches,Fossil Men Black Dial Watch AM4368 Stainless Steel Black
35324,35324.jpg,Jewellery,Fabindia Women Anusuya Silver Earrings Silver
18800,18800.jpg,Bags,Peter England Unisex Casual Navy Blue Backpack Navy Blue
6423,6423.jpg,Flip Flops,Lotto Men's Bavarian Black Yellow Flip Flop Black
17074,17074.jpg,Belts,Lino Perros Women Brown Belt Brown
23241,23241.jpg,Topwear,Aneri Women Juhi Blue Kurti Blue
19328,19328.jpg,Topwear,Myntra Men Maroon Sweatshirt Maroon
55007,55007.jpg,Lips,Lakme Sheer Satin Lip Gloss 11 Pink
22969,22969.jpg,Bags,U.S. Polo Assn. Black Unisex Lug-Laptop Backpack Black
3397,3397.jpg,Bags,Murcia Women Green Handbag Green
2245,2245.jpg,Topwear,ADIDAS Women White Polo T-shirt White
43162,43162.jpg,Watches,Fastrack Women Silver Dial Watch Silver
27427,27427.jpg,Loungewear and Nightwear,Jockey Women Purple Lounge Shorts 1308 Purple
46410,46410.jpg,Topwear,ADIDAS Men Purple Printed T-shirt Purple
7737,7737.jpg,Headwear,Puma Unisex Stripe Cat Black Cap Black
16360,16360.jpg,Topwear,Peter England Men Stripes Purple Shirt Purple
50575,50575.jpg,Innerwear,Chromozome Men Grey Trunks Grey Melange
34030,34030.jpg,Topwear,Gini and Jony Boys Check Blue Shirt Blue
20602,20602.jpg,Bags,Baggit Women Red Selection Lisa Sling Bag Red
58718,58718.jpg,Topwear,ALayna Women Green Kurta Green
14437,14437.jpg,Shoes,Enroute Women Silver Wedges Silver
52222,52222.jpg,Jewellery,Lencia Black and Silver Pendant Black
11979,11979.jpg,Shoes,Fila Men Glam Black Casual Shoes Black
36767,36767.jpg,Watches,Maxima Men Green Dial Watch Green
45295,45295.jpg,Watches,CASIO SHEEN Women Silver-Toned Dial Watch SX042 Metal Silver
57750,57750.jpg,Makeup,Lotus Herbals Natural Blend Comfort Liquid Sand Foundation 310 Skin
10097,10097.jpg,Shoes,Reebok Men Reeflex Run White Sports Shoes White
33215,33215.jpg,Topwear,Sepia Women Off White Top Off White
11145,11145.jpg,Topwear,Indigo Nation Men Bling Purple Shirts Purple
56682,56682.jpg,Watches,Maxima Men White Chronograph Watch Synthetic White
25370,25370.jpg,Innerwear,Levis Men Black Innerwear Vest Black
14605,14605.jpg,Socks,United Colors of Benetton Men Stripes Blue Socks Blue
44175,44175.jpg,Fragrance,Nike Fragrances Women Paradise Perfume and Deo Set White
5252,5252.jpg,Bags,Wildcraft Unisex Corporate Red Backpack Red
4380,4380.jpg,Topwear,Superman Men's Dont Art Me Dark Red T-shirt Red
33027,33027.jpg,Topwear,Mother Earth Women Printed Blue Kurta Blue
44949,44949.jpg,Fragrance,Kama Sutra Men Travel Mate Pack of 3 Deos Black
24090,24090.jpg,Topwear,Manchester United Men Red Sweatshirt Red
57562,57562.jpg,Lips,Lotus Herbals Pure Colors  Moisturising Pink Blush Lipstick 614 Pink
11377,11377.jpg,Topwear,United Colors of Benetton Men Summer Pink Shirts Pink
25142,25142.jpg,Bags,Lino Perros Women Red Clutch Red
41407,41407.jpg,Topwear,Wrangler Women Cowgirl Blue Top Blue
55235,55235.jpg,Makeup,Lakme 9 to 5 Flawless Makeup Pearl Foundation 30 ml Peach
13420,13420.jpg,Topwear,United Colors of Benetton Men Solid Purple  polo T-shirts Purple
43350,43350.jpg,Shoes,Reebok Men Black Fuel Extreme Sports Shoes Black
22367,22367.jpg,Topwear,Ed Hardy Men Vintage  Brick Red T-Shirt Red
51695,51695.jpg,Eyewear,Van Heusen Women Oversized Sunglasses VH215-C3 Plastic Purple
16152,16152.jpg,Shoes,Enroute Men Leather Brown Formal Shoes Brown
46622,46622.jpg,Shoes,Catwalk Women Multi colour Wedges Multi
7505,7505.jpg,Topwear,Nike Men's As Go Dunk T-Shirts White
19926,19926.jpg,Accessories,Reid & Taylor Men Formal Black Tie+Cufflink+Pocket square - Combo Pack Black
34202,34202.jpg,Bottomwear,Proline Men Black Track Pants Black
17080,17080.jpg,Wallets,Lino Perros Women Flower Turquoise Blue Wallet Blue
50747,50747.jpg,Shoes,Red Chief Men Mushroom Brown Shoes Mushroom Brown
36131,36131.jpg,Shoes,Nike Men Dunk High Maroon Shoes Maroon
39945,39945.jpg,Shoes,GAS Men Brown Namib Shoes Brown
52474,52474.jpg,Loungewear and Nightwear,Red Rose Women White & Blue Polka Dot Print Bath Robe Blue
21186,21186.jpg,Flip Flops,ADIDAS Men Star Story Blue Flip Flops Blue
20054,20054.jpg,Mufflers,United Colors Of Benetton Women Black Muffler Black
44511,44511.jpg,Sandal,Coolers Men Black Sandals Black
11713,11713.jpg,Topwear,Lee Women Check Green Tunics Green
25526,25526.jpg,Topwear,Wrangler Women Poppins Red Top Red
32591,32591.jpg,Bottomwear,ONLY Women Pink Skirt Pink
39179,39179.jpg,Topwear,Aneri Women Blue Kurtas Blue
20868,20868.jpg,Shoes,Fila Men Stradd White Casual Shoes White
58972,58972.jpg,Fragrance,Colour Me Women Red Perfume Red
33443,33443.jpg,Bags,Baggit Women Brown Handbag Brown
57106,57106.jpg,Topwear,Elle Women White Top White
13044,13044.jpg,Shoes,Inc 5 Women Casual Black Wedges Black
27271,27271.jpg,Topwear,Mother Earth Women Printed Red Tunic Red
43734,43734.jpg,Jewellery,Royal Diadem Set of 4 Golden Bangles Gold
31314,31314.jpg,Topwear,W Women Red & Blue Printed Kurta Red
8129,8129.jpg,Belts,Fastrack Men Grey Brass Buckles Brown Belts Brown
12196,12196.jpg,Topwear,Basics Men White Polo T-shirt White
55651,55651.jpg,Shoes,Catwalk Women Blue Flats Blue
13878,13878.jpg,Topwear,Scullers Men Check Red Shirts Red
47394,47394.jpg,Bags,Baggit Women Olive Handbag Olive
50323,50323.jpg,Topwear,Aurelia Women Red Kurta Red
28239,28239.jpg,Fragrance,Park Avenue Men Tranquil Deo Green
22703,22703.jpg,Shoes,Nike Men Capri II Mid Grey Casual Shoes Grey
16536,16536.jpg,Headwear,Probase Women Checked Orange & Red Cap Red
8915,8915.jpg,Shoe Accessories,Timberland Unisex Black Boot Sauce Cream Black
46246,46246.jpg,Topwear,Fusion Beats Women Green Printed Tunic Green
2621,2621.jpg,Topwear,Nike Men's Bleed blue India Colors T-shirt Blue
43506,43506.jpg,Topwear,French Connection Men Blue T-shirt Blue
55463,55463.jpg,Lips,Revlon Super Lusterous Perfectly Plum Lipstick 325 Maroon
31126,31126.jpg,Dress,Gini and Jony Girls White Dress White
34454,34454.jpg,Shoes,Rocia Women Brown Sandals Brown
46074,46074.jpg,Belts,Lino Perros Men Brown Leather Belt Brown
7353,7353.jpg,Topwear,Tantra Men's Moustaches Grey T-shirt Grey
35586,35586.jpg,Sandal,Gliders Men Brown Sandals Rubber Brown
16704,16704.jpg,Topwear,Fila Men High Density Navy Blue Tshirt Navy Blue
36303,36303.jpg,Topwear,Angry Birds Men Black Stop The Madness T-shirt Black
44723,44723.jpg,Flip Flops,Lotto Women White & Pink Blossom Flip Flops White
5404,5404.jpg,Shoes,Kalenji Kiprun 1000 Whi/ Blue 2011 White
20266,20266.jpg,Shoes,Catwalk Women Casual White Heels White
14053,14053.jpg,Topwear,Flying Machine Men Check  Blue Shirts Blue
53794,53794.jpg,Topwear,Puma Men Red Ferrari T-shirt Red
41251,41251.jpg,Belts,Arrow Men Black & Brown Reversible Belt Black
11521,11521.jpg,Topwear,United Colors of Benetton Men Blue T-shirt Blue
25714,25714.jpg,Headwear,ADIDAS Unisex NBA Black Cap Black
57334,57334.jpg,Innerwear,Amante Bra BCSO01 Grey
40383,40383.jpg,Topwear,Tokyo Talkies Women Pink Top Pink
38299,38299.jpg,Wallets,Reid & Taylor Men Brown Wallet Brown
58720,58720.jpg,Topwear,Puma Men White T-shirt White
11941,11941.jpg,Sandal,Ganuchi Men Casual Tan Sandals Tan
5864,5864.jpg,Shoes,Converse Chuck Taylor All Star Unisex Navy Blue & Red Shoe Navy Blue
57768,57768.jpg,Skin,Lotus Herbals Tea Tree Clarifying Face Pack White
25348,25348.jpg,Innerwear,Levis Men Green Brief Green
39717,39717.jpg,Topwear,Arrow Woman Red Top Red
49460,49460.jpg,Shoes,Vans Unisex Wine Authentic Shoes Purple
42088,42088.jpg,Shoes,ADIDAS Men Brown Zapotec Shoes Brown
19310,19310.jpg,Shoes,Nike Men Lunarglide+ 3 White Sports Shoe White
34834,34834.jpg,Shoes,ADIDAS Women Ranger Navy Blue Sports Shoes Navy Blue
9695,9695.jpg,Topwear,Classic Polo Men Vulcan White Polo Tshirts White
16358,16358.jpg,Topwear,Peter England Men Stripes White Shirt White
46428,46428.jpg,Watches,Timex Men Black Dial Watch Black
55803,55803.jpg,Loungewear and Nightwear,SDL by Sweet Dreams Women Purple Printed Night Suit S11-3127 Purple
34008,34008.jpg,Topwear,Gini and Jony Girls Pink Top Pink
28457,28457.jpg,Bottomwear,Urban Yoga Women Black Capris Black
43966,43966.jpg,Fragrance,DKNY Women Be Delicious Perfume Red
19122,19122.jpg,Flip Flops,Lotto Men XL Water Man White Slippers White
49652,49652.jpg,Topwear,Mineral Women Blue Top Blue
16956,16956.jpg,Eyewear,Image Men Classic Eyewear Brown Sunglasses Brown
43368,43368.jpg,Flip Flops,Reebok Men Blue Possession Flip Flops Blue
13418,13418.jpg,Topwear,United Colors of Benetton Men Solid White Shirts White
20408,20408.jpg,Belts,Baggit Women Chotu Taj Green Belt Green
58512,58512.jpg,Topwear,Tonga Women Printed Black Top Cream
33823,33823.jpg,Shoes,Puma Women Axis Grey Sports Shoes Grey
52028,52028.jpg,Topwear,Just Natural Unisex Brown Rain Jacket Brown
25946,25946.jpg,Scarves,Femella Women Brown Scarf Brown
44971,44971.jpg,Watches,Maxima Men Black Analog Chronograph Watch Black
39525,39525.jpg,Bags,Peter England Unisex Black Laptop Bag Black
52814,52814.jpg,Wallets,JAG Men Black Leather Wallet Black
56488,56488.jpg,Nails,Streetwear Barbie Pink Nail Polish 40 White
18494,18494.jpg,Shoes,Puma Men Daemon White Sports Shoes White
7965,7965.jpg,Topwear,Puma Men's Ess Polo Green T-shirt Green
19546,19546.jpg,Topwear,United Colors of Benetton Women Solid Black Sweatshirt Black
49236,49236.jpg,Headwear,Arrow Men Cream Cap Cream
8111,8111.jpg,Belts,Fastrack Men Canvas Blue Belt Blue
28201,28201.jpg,Eyewear,Ray-Ban Men High Street Arista Sunglasses Gold
13840,13840.jpg,Watches,ADIDAS Unisex Three Small Dials Black Watches Black
12992,12992.jpg,Shoes,ADIDAS Kids Unisex HyperRun Silver Sports Shoes Silver
41867,41867.jpg,Sandal,Estd. 1977 Men Red & Brown Sandals Synthetic Red
44529,44529.jpg,Sandal,Coolers Men Black Sandals Black
58176,58176.jpg,Bags,Rocky S Women Green Handbag Green
39141,39141.jpg,Apparel Set,Aneri Women Magenta Salwar Suit Magenta
59898,59898.jpg,Topwear,Femella Women Black Top Black
21982,21982.jpg,Bags,Murcia Women Casual Gold Clutch Gold
36935,36935.jpg,Fragrance,Ralph Lauren Men Perfume Blue
20850,20850.jpg,Bags,Spice Art Women White Beaded Elastic Flower Clutch Green
59296,59296.jpg,Topwear,U.S. Polo Assn. Men White & Green Shirt White
11519,11519.jpg,Shoes,Catwalk Women Bronze Brown Heels Brown
15985,15985.jpg,Topwear,Turtle Check Men Green Shirt Green
41269,41269.jpg,Wallets,Arrow Men Brown Wallet Brown
14857,14857.jpg,Wallets,United Colors of Benetton Women Solid Olive Wallets Olive
33649,33649.jpg,Sandal,Lotto Men Stride Black Sandals Black
54589,54589.jpg,Topwear,Sushilas Women Printed Green Kurta Green
2619,2619.jpg,Topwear,Nike Mens White Bleed Blue T-shirt White
8323,8323.jpg,Topwear,Doodle Boy's Athletic 77 Dept White Kidswear White
46870,46870.jpg,Socks,Lino Perros Men Pack of 2 Socks Purple
27847,27847.jpg,Topwear,Scullers For Her Off White T-shirt Off White
28033,28033.jpg,Innerwear,Jockey ELANCE Men Black Y Front Briefs 1006 Black
49838,49838.jpg,Flip Flops,iPanema Women Black Flip Flops Black
31922,31922.jpg,Bags,Fabindia Women Black Silk Handbag Black
26995,26995.jpg,Bottomwear,Jealous 21 Women Washed Light Blue Jeans Blue
9037,9037.jpg,Shoes,Buckaroo Men Medina Black Formal Shoes Synthetic Black
18460,18460.jpg,Fragrance,David Beckham Signature Women Deos White
13088,13088.jpg,Topwear,ADIDAS Men NBA Bold Red T-shirts Red
6843,6843.jpg,Shoe Accessories,Timberland Unisex Suede Restorer Brush Shoe Accessories Black
17428,17428.jpg,Watches,CASIO G-Shock Men Black Analogue-Digital Watch GA-100-1A2DR G271 Synthetic Black
47358,47358.jpg,Wallets,Baggit Women Olive Green Sanjara Jhuti Wallet Olive
12966,12966.jpg,Shoes,ADIDAS Men Snova Glide Grey Sports Shoes Grey
39989,39989.jpg,Shoes,Gas Men Skate Blue Shoes Blue
59050,59050.jpg,Shoes,Carlton London Women Red & Black Heels Red
4728,4728.jpg,Topwear,Disney Kids Boy's Crew Sea Life Sialing Navy Teen Kidswear Navy Blue
20098,20098.jpg,Topwear,Diva Women Printed Pink Kurta Pink
40941,40941.jpg,Topwear,Gini and Jony Girls Pretty Pink Top Pink
58182,58182.jpg,Bags,Rocky S Women Yellow Handbag Yellow
21976,21976.jpg,Bags,Murcia Women Casual Red Handbag Red
56018,56018.jpg,Lips,Colorbar Soft Touch Show Pink Charm Lipstick 038 Pink
37813,37813.jpg,Topwear,John Players Men Check Black Shirt Black
59262,59262.jpg,Watches,Titan Women Silver Watch Silver
1854,1854.jpg,Topwear,Inkfruit Mens Pencho T-shirt Purple
39387,39387.jpg,Bottomwear,Peter England Men Blue Jeans Blue
15971,15971.jpg,Topwear,Turtle Check Men Green Shirt Green
47956,47956.jpg,Bags,Murcia Women Pink Handbag Pink
9205,9205.jpg,Shoes,Puma Men SL Tech Lo NM Basic Black Casual Shoes Black
30038,30038.jpg,Watches,SKAGEN DENMARK Men White Dial Watch 233XLSS Synthetic White
48122,48122.jpg,Belts,Fossil Women Brown Belt Brown
42418,42418.jpg,Topwear,Gini and Jony Girls Woven White Top White
29929,29929.jpg,Watches,Police Men Copper-Toned Dial Watch PL12895JS Metal Copper
46884,46884.jpg,Shoes,Ben 10 Boys Black Casual Shoes Black
19780,19780.jpg,Bags,United Colors of Benetton Women Blue Handbag Blue
12368,12368.jpg,Topwear,Reid & Taylor Men Stripes Blue Shirts Blue
34498,34498.jpg,Topwear,Van Heusen Woman Striped Blue Top Blue
30804,30804.jpg,Topwear,Fabindia Men Rust Shirt Rust
29115,29115.jpg,Socks,Puma Men Foundation Quarters White Socks White
10867,10867.jpg,Topwear,Wrangler Men Navy Blue Tough Service Navy T-shirt Navy Blue
37679,37679.jpg,Bags,American Tourister Unisex Blue Backpack Blue
45259,45259.jpg,Watches,Casio EDIFICE Men Chronograph Watch ED61 EF-305D-1AVDF Black
15529,15529.jpg,Topwear,Puma Men Jersey Polo Black Tshirts Black
59606,59606.jpg,Saree,FNF Pink Collection for Wedding Wear Sari Pink
38631,38631.jpg,Topwear,Nike Women Pink Polo T-shirt Pink
5890,5890.jpg,Topwear,Puma Men's Graphics Story Green T-shirt Green
4942,4942.jpg,Topwear,Gini and Jony Boys Kane Red & White Kidswear Red
49494,49494.jpg,Shoes,Vans Men Navy Blue Shoes Navy Blue
26539,26539.jpg,Shoes,ID Men White & Black Shoes White
35912,35912.jpg,Bags,Peperone Women Pink & Black Handbag Pink
54119,54119.jpg,Shoes,Rocia Women Brown Flats Brown
18236,18236.jpg,Topwear,Manchester United Men Solid White Tshirt White
2289,2289.jpg,Topwear,Nike Women Blue T-shirt Blue
9661,9661.jpg,Topwear,Indigo Nation Men Reversible Bling Blue Shirts Blue
23877,23877.jpg,Shoes,Fila Men Cavier White Sports Shoes White
29571,29571.jpg,Shoes,Vans Men Classic Slip-On Navy Blue Shoes Navy Blue
42840,42840.jpg,Bags,French Connection Women Black Handbag Black
22199,22199.jpg,Shoes,Timberland Men Black Casual Shoes Black
54925,54925.jpg,Bottomwear,Do U Speak Green Men Cream Shorts Cream
6629,6629.jpg,Shoes,ADIDAS Men's Galvin White Silver Black Shoe White
43992,43992.jpg,Fragrance,Police Women Passion Eau De Toilette Natural Spray Pink
8581,8581.jpg,Topwear,Scullers Men Black Waistcoat Black
9453,9453.jpg,Topwear,John Miller Men White checks Blue Shirts Blue
17870,17870.jpg,Innerwear,Levis Men Boxer Black Brief Black
48774,48774.jpg,Jewellery,Lucera Women Silver Pendant Silver
18004,18004.jpg,Topwear,Puma Men Speed Grapic tee Blue Tshirt Blue
29743,29743.jpg,Bags,Kiara Women Light Green Handbag Green
3955,3955.jpg,Topwear,Jealous 21 Women Printed Red Top Red
51659,51659.jpg,Watches,Fossil Men Black Dial Watch AM4385 Stainless Steel Black
2887,2887.jpg,Shoes,Catwalk Women Black Ballerinas Beige
28691,28691.jpg,Topwear,W Women Printed Black Kurta Black
23279,23279.jpg,Watches,Maxima Ssteele Men Blue Watch Blue
