id,filename,subCategory,query
15970,15970.jpg,Topwear,Turtle Check Men Navy Blue Shirt Navy Blue
39386,39386.jpg,Bottomwear,Peter England Men Party Blue Jeans Blue
59263,59263.jpg,Watches,Titan Women Silver Watch Synthetic Silver
21379,21379.jpg,Bottomwear,Manchester United Men Solid Black Track Pants Black
53759,53759.jpg,Topwear,Puma Men Grey T-shirt Grey
1855,1855.jpg,Topwear,Inkfruit Mens Chain Reaction T-shirt Grey
30805,30805.jpg,Topwear,Fabindia Men Striped Green Shirt Green
26960,26960.jpg,Topwear,Jealous 21 Women Purple Shirt Purple
29114,29114.jpg,Socks,Puma Men Pack of 3 Socks Navy Blue
30039,30039.jpg,Watches,Skagen Men Black Watch Black
9204,9204.jpg,Shoes,Puma Men Future Cat Remix SF Black Casual Shoes Black
48123,48123.jpg,Belts,Fossil Women Black Huarache Weave Belt Black
18653,18653.jpg,Flip Flops,Fila Men Cush Flex Black Slippers Black
47957,47957.jpg,Bags,Murcia Women Blue Handbag Blue
46885,46885.jpg,Flip Flops,Ben 10 Boys Navy Blue Slippers Navy Blue
12369,12369.jpg,Topwear,Reid & Taylor Men Check Purple Shirts Purple
29928,29928.jpg,Watches,Police Men Black Dial Watch PL12889JVSB Metal Black
42419,42419.jpg,Topwear,Gini and Jony Girls Knit White Top White
51832,51832.jpg,Innerwear,Bwitch Beige Full-Coverage Bra BW335 Beige
47359,47359.jpg,Bags,Baggit Women Brown Handbag Brown
17429,17429.jpg,Watches,CASIO G-Shock Men Black Digital Watch G-7710-1DR G223 Synthetic Black
12967,12967.jpg,Sandal,ADIDAS Men Spry M Black Sandals Black
6842,6842.jpg,Shoe Accessories,Timberland Unisex Rubber Sole Brush Shoe Accessories Black
13089,13089.jpg,Topwear,ADIDAS Men Lfc Auth Hood Grey Sweatshirts Grey
18461,18461.jpg,Fragrance,David Beckham Signature Men Deos White
9036,9036.jpg,Shoes,Buckaroo Men Flores Black Formal Shoes Synthetic Black
48311,48311.jpg,Jewellery,Pitaraa Women Bronze Beaded Bracelet Bronze
7990,7990.jpg,Topwear,Fila Men's Round Neck Navy Blue T-shirt Navy Blue
56019,56019.jpg,Lips,Colorbar Soft Touch Show Stopper Copper Lipstick 037 Brown
21977,21977.jpg,Bags,Murcia Women Casual Brown Handbag Brown
37812,37812.jpg,Topwear,John Players Men Navy Blue Shirt Navy Blue
4729,4729.jpg,Topwear,Disney Kids Boy's Crew Sea Life Sialing Green Teen Kidswear Green
56825,56825.jpg,Topwear,John Players Men Brown Shirt Brown
39988,39988.jpg,Shoes,Gas Men Europa White Shoes White
59051,59051.jpg,Shoes,Carlton London Women Black & Gold Toned Flats Black
20099,20099.jpg,Topwear,Diva Women Embroided Green Kurta Green
58183,58183.jpg,Bags,Rocky S Women White Handbag White
29742,29742.jpg,Bags,Kiara Women Teal Handbag Teal
51658,51658.jpg,Watches,Fossil Women Copper Chronograph Watch CH2589 Synthetic Copper
3954,3954.jpg,Topwear,Jealous 21 Women's Pink T-shirt Pink
18839,18839.jpg,Belts,Peter England Men Formal Black Belt Black
2886,2886.jpg,Shoes,Catwalk Women Leather Brown Flats Brown
23278,23278.jpg,Watches,Maxima Ssteele Men Off White Watch Off White
28690,28690.jpg,Topwear,W Women Printed Beige Kurta Beige
8580,8580.jpg,Topwear,Scullers Men  Grey Waistcoat Grey
3168,3168.jpg,Shoes,Nike Men's Incinerate MSL White Blue Shoe White
18005,18005.jpg,Bottomwear,Puma Men Long Logo Black Bermuda Black
17871,17871.jpg,Innerwear,Levis Men Boxer Maroon Brief Maroon
9452,9452.jpg,Topwear,John Miller Men Stripes White Red Shirts Red
38402,38402.jpg,Belts,Baggit Women Hood Dabang Black Belt Black
44984,44984.jpg,Watches,Maxima Women White Dial Watch White
10268,10268.jpg,Shoes,Clarks Men Hang Work Leather Black Formal Shoes Black
45856,45856.jpg,Topwear,Vishudh Women Brown Kurta Brown
32138,32138.jpg,Innerwear,Playboy Men Blue Titanium Briefs Blue
59435,59435.jpg,Shoes,Arrow Men Black Formal Shoes Black
5891,5891.jpg,Topwear,Puma Men's Stripe Polo Black T-shirt Black
38630,38630.jpg,Topwear,Nike Women Purple Polo T-shirt Purple
4943,4943.jpg,Topwear,Gini and Jony Boy's Kaleb White Brown Kidswear White
11188,11188.jpg,Watches,Carrera Men Dial steel finish strap Silver Watches Silver
10866,10866.jpg,Topwear,Wrangler Men Motor Rider Red T-Shirts Red
59607,59607.jpg,Saree,FNF Pink & Grey Wedding Collection Sari Grey
15528,15528.jpg,Topwear,Puma Men Scribble Black Tshirts Black
45258,45258.jpg,Watches,CASIO EDIFICE Men Black Dial Chronograph Watch ED60 Leather Black
42841,42841.jpg,Bags,French Connection Women Beige Handbag Beige
22198,22198.jpg,Shoes,Timberland Men Black Casual Shoes Black
29570,29570.jpg,Shoes,Vans Men Classic Slip-On Purple & Black Shoes Purple
43993,43993.jpg,Fragrance,Police Women Passion Perfume Pink
6628,6628.jpg,Shoes,ADIDAS Men's Lowell White Silver Shoe White
54924,54924.jpg,Bottomwear,Do U Speak Green Men Blue Shorts Blue
26538,26538.jpg,Shoes,ID Men Red Shoes Red
35913,35913.jpg,Bags,Peperone Women Black & White Handbag Black
49495,49495.jpg,Shoes,Vans Men Khaki Shoes Khaki
9660,9660.jpg,Topwear,Indigo Nation Men Reversible Bling Pink Shirts Pink
2288,2288.jpg,Topwear,Nike Women Black T-shirt Black
23876,23876.jpg,Topwear,ADIDAS Men Blue Sweatshirt Blue
18237,18237.jpg,Topwear,Manchester United Men Solid Red Tshirt Red
54118,54118.jpg,Shoes,Rocia Women Black Flats Black
2872,2872.jpg,Shoes,Catwalk Women Leather Flats Brown
49653,49653.jpg,Topwear,Mineral Women Green Top Green
8574,8574.jpg,Sandal,Crocs Dora Boots Pink Sandals Pink
16957,16957.jpg,Eyewear,Image Men Sunglasses Metal Black
19123,19123.jpg,Flip Flops,Lotto Men XL Water Man Silver Slippers Silver
13419,13419.jpg,Topwear,United Colors of Benetton Men Solid Pink Polo T-shirts Pink
17885,17885.jpg,Innerwear,Levis Men Comfort Style Grey Innerwear Vest Grey
43369,43369.jpg,Flip Flops,Reebok Men Black Possession Flip Flops Black
48781,48781.jpg,Jewellery,Lucera Women Silver Pendant Silver
44970,44970.jpg,Watches,Maxima Men White Dial Analog Chronograph Watch White
56489,56489.jpg,Nails,Streetwear Ash Nail Polish # 31 Bronze
39524,39524.jpg,Bags,Peter England Unisex Orange Sleeve Bag Orange
33822,33822.jpg,Shoes,Puma Men Axis White & Grey Sports Shoes White
58513,58513.jpg,Topwear,Tonga Women Maroon Top Off White
25947,25947.jpg,Scarves,Femella Women Brown Scarf Brown
52029,52029.jpg,Topwear,Just Natural Unisex Charcoal Rain Jacket Coffee Brown
5865,5865.jpg,Topwear,ADIDAS Men's Twelve Faster T-shirt Black
39716,39716.jpg,Dress,Arrow Woman Women Blue Dress Blue
25349,25349.jpg,Innerwear,Levis Men Red Brief Red
11940,11940.jpg,Sandal,Ganuchi Men Casual Black Sandals Black
55802,55802.jpg,Loungewear and Nightwear,SDL by Sweet Dreams Women Green Printed Night Suit S11-3124 White
29584,29584.jpg,Topwear,Indigo Nation Men Printed Black T-shirt Black
43967,43967.jpg,Fragrance,DKNY Women Red Delicious Perfume Red
28456,28456.jpg,Bottomwear,Urban Yoga Women Blue Skirt With Leggings Blue
34009,34009.jpg,Topwear,Gini and Jony Girls Black Top Black
19311,19311.jpg,Shoes,Nike Men Air Rift MTR White Casual Shoe White
42089,42089.jpg,Shoes,ADIDAS Men White Corona Sports Shoes White
22950,22950.jpg,Watches,Fastrack Unisex Black Dial Watch 9915PP13 Synthetic Black
49461,49461.jpg,Shoes,Vans Men Blue Era Scilla Plaid Shoes Blue
8746,8746.jpg,Flip Flops,Crocs Kids Navy Blue Clogs Navy Blue
9694,9694.jpg,Topwear,Classic Polo Men Vulcan White Polo Tshirts White
23882,23882.jpg,Shoes,Fila Men Destiny Grey Sports Shoes Grey
34835,34835.jpg,Shoes,ADIDAS Men Blue Chill Sports Shoes Blue
15984,15984.jpg,Topwear,Turtle Check Men Yellow Shirt Yellow
41268,41268.jpg,Wallets,Arrow Men Black Wallet Black
11518,11518.jpg,Shoes,Catwalk Women Gun Metal Grey Heels Grey
14856,14856.jpg,Wallets,United Colors of Benetton Women Solid Beige Wallets Beige
33648,33648.jpg,Sandal,Lotto Men Ridge Brown Sandals Brown
59297,59297.jpg,Topwear,U.S. Polo Assn. Men White & Navy Blue Shirt White
28032,28032.jpg,Innerwear,Jockey ELANCE Men Bikini White Brief 1005 White
27846,27846.jpg,Topwear,Scullers For Her Charcoal Blazer Charcoal
26994,26994.jpg,Bottomwear,Jealous 21 Women Black Jeans Black
49839,49839.jpg,Flip Flops,iPanema Women Red Flip Flops Red
31923,31923.jpg,Bags,Fabindia Women Blue Silk Sling Bag Blue
2618,2618.jpg,Shoes,Carlton London Women Silver Wedge Sandal Silver
54588,54588.jpg,Topwear,Sushilas Women Printed Green Kurta Green
49005,49005.jpg,Jewellery,Lucera Women Silver Ring Silver
8322,8322.jpg,Topwear,Doodle Boy's Route 66 Biker Blue Teen Kidswear Blue
13841,13841.jpg,Watches,ADIDAS Unisex Three Small Dials White Watches White
28200,28200.jpg,Eyewear,Ray-Ban Men Active Lifestyle Copper Sunglasses Copper
12993,12993.jpg,Shoes,ADIDAS Kids Adispeed Black Sports Shoes Black
7158,7158.jpg,Topwear,Scullers Men  Green Check Shirt Green
18495,18495.jpg,Sandal,Puma Men Fashion Cat White Slipper White
8110,8110.jpg,Watches,Fastrack Men Economy 2 Analg Black Watch Black
19547,19547.jpg,Topwear,United Colors of Benetton Men Solid Blue Sweatshirt Blue
7964,7964.jpg,Topwear,Puma Men's Large Logo Graphic Black T-shirt Black
36934,36934.jpg,Fragrance,Giorgio Armani Women Idole Perfume Gold
39140,39140.jpg,Apparel Set,Aneri Women Black & Maroon Salwar Suit Black
20851,20851.jpg,Bags,Spice Art Women Ribbon Embroidery Red Clutch Red
41866,41866.jpg,Sandal,Estd. 1977 Men Beige & Green Sandals Beige
58177,58177.jpg,Bags,Rocky S Women Brown Handbag Brown
44528,44528.jpg,Sandal,Coolers Men Black Sandals Black
16392,16392.jpg,Topwear,Levis Men Check Red Shirts Red
51455,51455.jpg,Topwear,Tonga Women Pink Printed Shrug Pink
50587,50587.jpg,Innerwear,Chromozome Men Grey Briefs Grey
17240,17240.jpg,Topwear,U.S. Polo Assn. Men Stripes Black  Polo Tshirt Black
47530,47530.jpg,Shoes,Portia Women Copper-Toned & Brown Sandals TPR Copper
6617,6617.jpg,Topwear,Spykar Men Black and white Check Shirt Black
12732,12732.jpg,Bags,Nike Unisex Swoosh Black Backpack Black
3365,3365.jpg,Topwear,Myntra Men's Brain Black T-shirt Black
42042,42042.jpg,Shoes,Nike Men Air Relentless 2 MSL White Sports Shoes White
23849,23849.jpg,Shoes,ADIDAS Men Black Anzo Breeze Casual Shoes Black
43190,43190.jpg,Watches,Fastrack Women White Dial Watch White
48578,48578.jpg,Jewellery,Revv Men Steel Bracelet Steel
30462,30462.jpg,Innerwear,Lovable Women All Day Long Black Bra Black
18208,18208.jpg,Headwear,Manchester United Men Solid White Cap White
54127,54127.jpg,Shoes,Rocia Women Black Heels Black
10065,10065.jpg,Topwear,Puma Men ducati logo tee Yellow Tshirts Yellow
24250,24250.jpg,Shoes,Numero Uno Men White Casual Shoes White
32335,32335.jpg,Watches,Q&Q Men Silver-Toned Dial Analogue Watch Q252J404Y Stainless Steel Silver
25382,25382.jpg,Innerwear,Levis Men White Innerwear Vest White
56670,56670.jpg,Watches,Maxima Men Black Dial Watch Synthetic Black
5092,5092.jpg,Topwear,Wrangler Men's Minstrel Shoulder Loop Purple T-shirt Purple
10859,10859.jpg,Topwear,Wrangler Men Furious Rides Navy Blue T-Shirts Navy Blue
59638,59638.jpg,Saree,FNF Green Wedding Collection Sari Green
15517,15517.jpg,Shoes,Rockport Men LLandro Red Casual Shoes Red
4140,4140.jpg,Shoes,Skechers Women Green Shoe Synthetic Green
36795,36795.jpg,Watches,Maxima Men Ssteele Silver Dial Watch Silver
40527,40527.jpg,Watches,Titan Men Gold Dial Watch Gold
10257,10257.jpg,Bottomwear,John Miller Men Solid Type Black Trousers Black
24062,24062.jpg,Topwear,Locomotive Men Navy Blue Printed T-shirt Navy Blue
45869,45869.jpg,Watches,Maxima Men Brown Dial Watch Brown
11385,11385.jpg,Topwear,United Colors Of Benetton Women Light Winter Black Sweatshirts Black
53130,53130.jpg,Shoes,Catwalk Women Brown Sandals Brown
44187,44187.jpg,Fragrance,Nike Fragrances Women 5th Element Perfume 150 ml White
21510,21510.jpg,Bags,Kiara Women Graphiti White Handbag White
51667,51667.jpg,Eyewear,Louis Philippe Men Grey Sunglasses Metal Grey
22395,22395.jpg,Topwear,Mark Taylor Men Striped Blue Shirt Blue
35322,35322.jpg,Jewellery,Fabindia Women Anusuya Silver Earrings Silver
6425,6425.jpg,Shoes,Lotto Unisex Canvas Black Check Shoe Black
18806,18806.jpg,Belts,Peter England Men Casual Tan Belt Tan
23247,23247.jpg,Shoes,Arrow Men Formal Black Shoe Black
17072,17072.jpg,Belts,Lino Perros Women Weaved  Grey Belt Grey
31782,31782.jpg,Topwear,Lee Women Paula Blue Top Blue
42270,42270.jpg,Shoes,Vans Unisex Black & Grey Classic Shoes Black
12500,12500.jpg,Topwear,United Colors of Benetton Men Short Black Shirts Black
26735,26735.jpg,Fragrance,Reebok Men Pack of 2 Pirates of the Caribbean Deos Black
30650,30650.jpg,Topwear,Nike Men Printed Black T-shirt Black
56026,56026.jpg,Lips,Colorbar Soft Touch Mousse Lipstick 025 Brown
21948,21948.jpg,Bags,Murcia Women Casual Brown Handbag Brown
32563,32563.jpg,Bottomwear,ONLY Women directoire blue Trousers Blue
58980,58980.jpg,Fragrance,Colour me Women Flowers Deo Pink
40143,40143.jpg,Topwear,Gini and Jony Girls Pretty Blossom Blue Top Blue
10633,10633.jpg,Shoes,Carlton London Men Formal Brown Formal Shoes Synthetic Brown
24406,24406.jpg,Topwear,Vishudh Women Red Printed Kurta Red
4716,4716.jpg,Watches,ADIDAS Unisex Response ST Analogue Black Watch Black
21174,21174.jpg,Topwear,s.Oliver Women Stripes Beige Top Beige
15341,15341.jpg,Bottomwear,Nike Women Solid Pink Shorts Pink
52486,52486.jpg,Innerwear,Red Rose Maroon Camisole Maroon
53554,53554.jpg,Innerwear,Probase Multicoloured Printed Boxers Multi
14293,14293.jpg,Topwear,Classic Polo Men Stripes Blue Tshirts Blue
47366,47366.jpg,Bags,Baggit Women Blue Bag Blue
6041,6041.jpg,Topwear,UCB Men's Polo Neck With Lion Logo Navy Blue T-shirt Navy Blue
23623,23623.jpg,Topwear,Doodle Kids Girls Pink I love Shopping Top Pink
17416,17416.jpg,Shoes,Lotto Men Atlantica Black Sports Shoe Black
9835,9835.jpg,Topwear,Little Miss Women Printed Grey T-shirt Grey
29319,29319.jpg,Bags,ADIDAS Unisex Chicago Bulls Red Backpack Red
7193,7193.jpg,Bottomwear,Jealous 21 Women Black Jegging Black
12958,12958.jpg,Shoes,ADIDAS Men Sports Black Sports Shoes Black
27283,27283.jpg,Topwear,Mother Earth Women Magenta Kurta Magenta
30234,30234.jpg,Flip Flops,Numero Uno Men Black Flip Flops Black
9009,9009.jpg,Bags,Murcia Women Snake Print Bag Brown Handbags Brown
3533,3533.jpg,Topwear,Myntra Men's If You Don't Like Navy Blue T-shirt Navy Blue
42614,42614.jpg,Jewellery,Estelle Women Earrings & Pendant Set Gold
12164,12164.jpg,Topwear,Aurelia Women Voile Orange Dupatta Orange
26351,26351.jpg,Watches,DKNY Women White Dial Watch NY8472 Metal White
17624,17624.jpg,Bottomwear,ADIDAS Men Solid Navy Blue Track Pant Navy Blue
47154,47154.jpg,Bottomwear,Gini and Jony Girls Black Capris Black
35574,35574.jpg,Flip Flops,Gliders Men Esquire Red Flip Flops Red
46086,46086.jpg,Shoes,ADIDAS Women Lavender Hagkok Sports Shoes Lavender
51031,51031.jpg,Innerwear,Enamor White Bra White
13284,13284.jpg,Bottomwear,Gini and Jony Kids Boys Solid Black Shorts Black
54543,54543.jpg,Shoes,F Sports Men White Outlander Sports Shoes White
55491,55491.jpg,Lips,Revlon Gold Dust Poussiere Doree Colorburst Lip Gloss 024 Brown
26163,26163.jpg,Bottomwear,John Miller Men Dark Grey Trousers Grey
3701,3701.jpg,Topwear,Tantra Women Flower Heart Black Long T-shirt Black
29917,29917.jpg,Watches,Police Men White Dial Watch PL12698JS Metal White
42426,42426.jpg,Topwear,Aurelia Women Sea Green Kurta Sea Green
32751,32751.jpg,Shoes,FILA Men Liga II Black Shoes Black
56214,56214.jpg,Jewellery,Estelle Women Gold Earrings Gold
10401,10401.jpg,Topwear,Jealous 21 Women Uaine Purple Tops Purple
40371,40371.jpg,Bottomwear,Tokyo Talkies Women Navy Slim Fit Jeans Navy Blue
21346,21346.jpg,Eyewear,Pal Zileri Men Casual Gold Frame Sunglasses Gold
45603,45603.jpg,Shoes,Arrow Men Black Formal Shoes Black
4524,4524.jpg,Shoes,Puma Men's YugoRun Black White Shoe Black
37223,37223.jpg,Topwear,United Colors of Benetton Women Blue Top Blue
53766,53766.jpg,Topwear,Puma Men White and Navy Blue T-shirt White
25520,25520.jpg,Topwear,Doodle Kids Girls City Chic White Top White
32597,32597.jpg,Topwear,ONLY Women Black Top Black
58974,58974.jpg,Fragrance,Colour me Men Gold Deo Gold
33445,33445.jpg,Wallets,Baggit Women Lamboo Mayur Black Wallet Black
57100,57100.jpg,Topwear,Elle Women Dark Pink Top Pink
36137,36137.jpg,Shoes,Nike Women Free Run Pink Sports Shoes Pink
41859,41859.jpg,Sandal,Estd. 1977 Men Black Sandals Synthetic Black
21180,21180.jpg,Flip Flops,ADIDAS Men Adi Cells Black Flip Flops Black
39943,39943.jpg,Shoes,GAS Men Brown Count Casual Shoes Brown
52472,52472.jpg,Loungewear and Nightwear,Red Rose Women White & Pink Polka Dot Print Bath Robe Pink
58148,58148.jpg,Headwear,Puma Unisex White Cap White
20052,20052.jpg,Mufflers,United Colors Of Benetton Women Yellow Muffler Yellow
5630,5630.jpg,Flip Flops,ADIDAS Women's Adi Groove Blue Flip Flop Blue
44517,44517.jpg,Flip Flops,Coolers Men Brown Pokar Flip Flops Rubber Brown
47392,47392.jpg,Bags,Baggit Women Beige Bag Beige
50325,50325.jpg,Topwear,Aurelia Women Navy Blue Kurta Navy Blue
8913,8913.jpg,Shoes,Puma Men Cabana Racer Sketch White Sports Shoes White
16530,16530.jpg,Topwear,Locomotive Men Check Red Shirt Red
22705,22705.jpg,Shoes,Nike Men White Capri II Casual Shoe White
7167,7167.jpg,Topwear,Scullers Men Scul Purple White Shirt Purple
46240,46240.jpg,Topwear,Fusion Beats Women White Printed Tunic White
27277,27277.jpg,Topwear,Mother Earth Women Blue Kurta Green
13042,13042.jpg,Shoes,Inc 5 Women Brown Heels Brown
6889,6889.jpg,Topwear,Forever New Women Stone Cream Jacket Cream
31312,31312.jpg,Topwear,W Women Peach Kurta Peach
12190,12190.jpg,Topwear,Basics Men Blue Slim Fit Checked Shirt Blue
55657,55657.jpg,Shoes,Catwalk Women Golden Wedges Gold
19578,19578.jpg,Topwear,United Colors of Benetton Women Solid Purple Top Purple
27879,27879.jpg,Topwear,Scullers For Her Women Blue Top Blue
34452,34452.jpg,Shoes,Rocia Women Copper Sandals Copper
6287,6287.jpg,Topwear,Classic Polo Men's Swiss Yellow T-shirt Yellow
7355,7355.jpg,Topwear,Tantra Men's Black Sabbath Navy T-shirt Navy Blue
46072,46072.jpg,Belts,Lino Perros Men Black Leather Belt Black
22537,22537.jpg,Sandal,Gas Men Eldorado Tan Casual  Sandals Tan
28831,28831.jpg,Innerwear,Enamor Women Pack of 3 Mid-Rise Bikini Brief Brown
43500,43500.jpg,Topwear,French Connection Men White T-shirt White
2627,2627.jpg,Shoes,Carlton London Women Wedge Silver Sandal Silver
27045,27045.jpg,Bags,Yelloe Off White Fur Zip Clutch Off White
13270,13270.jpg,Topwear,Palm Tree Kids Girls Printed White Tops White
18698,18698.jpg,Innerwear,Hanes Men Grey Ultimate Duo Dry Cotton Stretch Bikini Briefs Grey
55465,55465.jpg,Lips,Revlon Super Lusterous Lipstick 304 Red
26197,26197.jpg,Fragrance,Formula 1 Go Men Perfume Green
31120,31120.jpg,Topwear,Palm Tree Girls Pink Top Pink
25712,25712.jpg,Headwear,ADIDAS Unisex Blue Cap Blue
11527,11527.jpg,Topwear,United Colors of Benetton Men Olive Tshirts Olive
14869,14869.jpg,Wallets,United Colors of Benetton Men Solid Black Wallets Black
40385,40385.jpg,Topwear,Tokyo Talkies Women Yellow Top Yellow
15187,15187.jpg,Topwear,Arrow Sport Men Solid White Polo Tshirts White
5402,5402.jpg,Shoes,Kalenji Ekiden 200 Wn Purple 2011 Purple
44725,44725.jpg,Flip Flops,Lotto Women Coral Elegant Flip Flops Orange
14055,14055.jpg,Topwear,Flying Machine Men Check Green Shirts Green
20260,20260.jpg,Topwear,Wrangler Men Applique Navy Blue Tshirt Navy Blue
7731,7731.jpg,Flip Flops,Puma Men's Winglet II Grey Yellow White Flip Flop Grey
22153,22153.jpg,Sandal,Lee Cooper Men Brown Casual Sandals Brown
43958,43958.jpg,Sandal,Puma Men Olive Techno Ind Sandal Olive
28469,28469.jpg,Topwear,Urban Yoga Women Printed Pink T-shirt Pink
50573,50573.jpg,Innerwear,Chromozome Men Charcoal Trunk Trunks Charcoal
34036,34036.jpg,Topwear,Palm Tree Boys Check Blue Shirt Blue
55001,55001.jpg,Lips,Lakme Absolute Lip Last Day Kiss Lip Colour Pink
8779,8779.jpg,Topwear,Indigo Nation Men Club Satin Hot Stepper Navy Blue Shirt Navy Blue
3391,3391.jpg,Bags,Murcia Women White With Stitch Bag White
43164,43164.jpg,Watches,Fastrack Men Black Watch Black
2243,2243.jpg,Topwear,ADIDAS Men Stripe Polo White Polo T-shirt White
30496,30496.jpg,Innerwear,Lovable Women Fiona Purple Bra Purple
27421,27421.jpg,Loungewear and Nightwear,Jockey Women Blue Lounge Pants Blue
57756,57756.jpg,Skin Care,Lotus Herbals Neem & Clove Purifying Face Wash Green
33213,33213.jpg,Topwear,Sepia Women Printed Magenta Top Magenta
39729,39729.jpg,Topwear,Arrow Woman Olive Top Olive
25376,25376.jpg,Innerwear,Levis Men Grey Innerwear T-Shirt Grey
11143,11143.jpg,Topwear,Scullers Men Price Catch Black Shirts Black
56684,56684.jpg,Saree,Fabindia Beige & Maroon Mull Printed Saree Beige
4988,4988.jpg,Dress,Gini and Jony Girl's Vanya White Polka Dot Kidswear White
44341,44341.jpg,Topwear,Indian Terrain Men Blue T-shirt Blue
14431,14431.jpg,Shoes,Enroute Women Casual Black Flats Black
20604,20604.jpg,Bags,Baggit Women Umbrella Dum Brown Handbag Brown
52224,52224.jpg,Jewellery,Lencia Grey Swarovski Pearl Necklace Silver
45293,45293.jpg,Watches,CASIO SHEEN Women Red Dial Watch SX017 Synthetic Red
36761,36761.jpg,Watches,Maxima Men Black Watch Black
33021,33021.jpg,Topwear,Mother Earth Women Printed Cream Kurta Cream
25144,25144.jpg,Bags,Lino Perros Women Leatherite Orange Handbag Orange
11371,11371.jpg,Topwear,United Colors Of Benetton Men Summer Black Shirts Black
41401,41401.jpg,Topwear,Wrangler Women White Smocked Top White
14603,14603.jpg,Socks,United Colors of Benetton Men Pack of 2 Grey Socks Grey
37481,37481.jpg,Watches,Esprit Women White Dial Watch White
5254,5254.jpg,Bags,Wildcraft Unisex Red Duffle Bag Red
44173,44173.jpg,Fragrance,Nike Fragrances Women Trendy Perfume 75ml Pink
25978,25978.jpg,Fragrance,J.Del Pozo Halloween Kiss Sexy Women Perfume Pink
4386,4386.jpg,Topwear,Wrangler Cowboy Photo T-shirt Grey
51693,51693.jpg,Eyewear,Van Heusen Unisex Brown Sunglasses Plastic Brown
16154,16154.jpg,Shoes,Enroute Men Leather Black Formal Shoes Black
22361,22361.jpg,Sandal,Reebok Men Navy Twist Sandals Navy Blue
29789,29789.jpg,Topwear,Basics Men Pack of 3 T-shirt Pink
19920,19920.jpg,Bags,Wildcraft Unisex Black Outdoor Backpack Black
7503,7503.jpg,Topwear,Nike Men's As Icon Blue T-shirt Blue
46624,46624.jpg,Fragrance,Rasasi Men Emotion Deo and Perfume Set Grey
34204,34204.jpg,Bottomwear,Proline Men Navy Track Pants Navy Blue
17086,17086.jpg,Wallets,Lino Perros Women Blue Zip Orange Wallet Orange
50741,50741.jpg,Shoes,Red Chief Men Black Shoes Black
55233,55233.jpg,Makeup,Lakme Nine to Five Flawless Makeup Shell Foundation Skin
13426,13426.jpg,Topwear,United Colors of Benetton Men Stripes Red  Polo T-shirts Red
43356,43356.jpg,Shoes,Reebok Women Charcoal Grey Fuel Techno Sports Shoes Charcoal
28207,28207.jpg,Eyewear,Ray-Ban Men Active Lifestyle Black Sunglasses Black
13846,13846.jpg,Topwear,John Miller Men Stripes Blue Shirts Blue
12994,12994.jpg,Shoes,ADIDAS Kids Boys Duramo Synthetic Black Sports Shoes Black
46278,46278.jpg,Topwear,109F Women Red & White Striped Tunic Red
16508,16508.jpg,Bottomwear,Locomotive Men Washed Blue Jeans Blue
18492,18492.jpg,Flip Flops,Puma Men Danny Blue Slipper Blue
19540,19540.jpg,Topwear,United Colors of Benetton Men Solid Blue Sweater Blue
7963,7963.jpg,Topwear,Puma Men's Large Logo Graphic White French T-shirt White
8117,8117.jpg,Watches,Fastrack Men New Analog Black Navy Watch Black
49230,49230.jpg,Socks,Calzini Men Pack of 5 Sports Socks Black
39147,39147.jpg,Apparel Set,Aneri Women Purple Salwar Suit Purple
36933,36933.jpg,Fragrance,Bulgari Women Omnia Perfume Purple
57138,57138.jpg,Bottomwear,Elle Women Brown Trousers Brown
20856,20856.jpg,Shoes,United Colors of Benetton Men Casual Black Shoes Black
41861,41861.jpg,Sandal,Estd. 1977 Men Black Sandals Synthetic Black
5608,5608.jpg,Sandal,ADIDAS Men Kendall Black Navy Floater Black
58170,58170.jpg,Bags,Rocky S Women Red Clutch Red
53598,53598.jpg,Free Gifts,Q&Q Men Black Digital Watch Black
15983,15983.jpg,Topwear,Turtle Solid Men  Burgundy Shirt Burgundy
39375,39375.jpg,Watches,Helix Women Silver Dial Watch Silver
14851,14851.jpg,Wallets,United Colors of Benetton Women Solid Coffee Brown Wallets Coffee Brown
59290,59290.jpg,Watches,Titan Men Black Dial Watch Synthetic Black
52678,52678.jpg,Watches,Morellato Men Black Watch Black
20258,20258.jpg,Topwear,Wrangler Men Polo Charcoal T-shirt Brown
47198,47198.jpg,Sandal,Franco Leone Men Brown Sandals Brown
27841,27841.jpg,Belts,Bulchee Men Plain Jeans White Belt White
28035,28035.jpg,Innerwear,Jockey ELANCE Men Grey Melange Y Front Briefs 1006 Grey Melange
31924,31924.jpg,Bags,Fabindia Women Black Silk Handbag Black
26993,26993.jpg,Bottomwear,Jealous 21 Women Washed Blue Jeans Blue
13248,13248.jpg,Bottomwear,Palm Tree Kids Boy Solid Brown Trousers Brown
43538,43538.jpg,Topwear,French Connection Women Blue Top Blue
8325,8325.jpg,Topwear,Doodle Boy's Athletic 77 Dept Yellow Teen Kidswear Yellow
31118,31118.jpg,Topwear,Gini and Jony Girls Red Top Red
19772,19772.jpg,Shoes,ADIDAS Men Vigor Blue Casual Shoes Blue
46876,46876.jpg,Socks,Lino Perros Men Pack of 2 Socks Grey
5862,5862.jpg,Topwear,ADIDAS Men's Stripe Black T-shirt Black
39711,39711.jpg,Watches,ADIDAS Original Men Black Dial Chronograph Watch ADH2641 Stainless Steel Black
14409,14409.jpg,Shoes,Enroute Women Casual White Heels White
58726,58726.jpg,Topwear,Puma Men Grey T-shirt Grey
44379,44379.jpg,Fragrance,ADIDAS Men Intense Touch  Perfume Black
11947,11947.jpg,Sandal,Ganuchi Men Casual Olive Sandals Olive
36759,36759.jpg,Watches,Maxima Men White Dial Watch Synthetic White
51499,51499.jpg,Bottomwear,Denizen Women Blue Jeans Blue
29583,29583.jpg,Shoes,Puma Women Grace Silver Sandals Silver
55805,55805.jpg,Loungewear and Nightwear,SDL by Sweet Dreams Women Pink & Black Printed Night Suit S11-3134 Pink
7709,7709.jpg,Bottomwear,Jealous 21 Women's Aaren Black Jegging Black
28451,28451.jpg,Bottomwear,Urban Yoga Women Black Track Pants Black
43960,43960.jpg,Topwear,Indigo Nation Men Grey Striped Shirt Grey
8741,8741.jpg,Topwear,Indigo Nation Men Checks Shirt Navy Blue Shirts Navy Blue
55039,55039.jpg,Lips,Lakme Absolute Matte Merlot Lipstick 45 Brown
19316,19316.jpg,Bags,Nike Unisex Hayward 25M Grey Backpack Grey
27419,27419.jpg,Loungewear and Nightwear,Jockey Women Black Lounge Pants Black
34832,34832.jpg,Shoes,ADIDAS Men Sukoi White Sports Shoes White
