id,filename,subCategory,query
23615,23615.jpg,Fragrance,Nike Fragrances Women Basic Perfume Red
17420,17420.jpg,Watches,Casio Enticer Men Black Dial Analogue Watch A479 Stainless Steel Black
9803,9803.jpg,Topwear,Scullers For Her Women Scullers Top Navy Blue Tops Navy Blue
3505,3505.jpg,Shoes,ADIDAS Women Adi Light White Fresh Shoe White
42622,42622.jpg,Jewellery,Estelle Women Earrings Gold
12152,12152.jpg,Topwear,Aurelia Women Printed Purple Kurti Purple
26367,26367.jpg,Topwear,Arrow Woman Lavender Shirt Lavender
18468,18468.jpg,Fragrance,Reebok Reelive Women Perfumes White
13080,13080.jpg,Shoes,Numero Uno Men Black Casual Shoes Black
48318,48318.jpg,Jewellery,Pitaraa Silver Omelette Thin Bracelet Silver
30202,30202.jpg,Bags,Nike Unisex Classic Turf Navy Blue Backpack Navy Blue
33487,33487.jpg,Topwear,Doodle Kids Boy Check Red Shirt Red
40175,40175.jpg,Eyewear,Fastrack Men Revo Coated Sporty Wrap Sunglasses Grey
10605,10605.jpg,Watches,Esprit Women Houston Funny Pink Watches Synthetic Pink
56010,56010.jpg,Lips,Colorbar Velvet Matte Hot Hot Hot Red Lipstick 01R Red
32555,32555.jpg,Shoes,Playboy Men White Shoes White
53562,53562.jpg,Watches,Q&Q Unisex Blue Dial Watch Blue
40949,40949.jpg,Topwear,Gini and Jony Boys Around the World White T-shirt White
45407,45407.jpg,Shoes,Rocia Women Brown Sandals Brown
4720,4720.jpg,Topwear,Disney Kids Girl's Fun In The Fair Yellow Teen Kidswear Yellow
21142,21142.jpg,Topwear,s.Oliver Women Grey Top Grey
39981,39981.jpg,Shoes,Gas Men Jack Grey Shoes Grey
59058,59058.jpg,Topwear,Global Desi Women Black Kurti Black
15377,15377.jpg,Shoes,Fila Men Lobato Navy Blue Casual Shoes Navy Blue
10437,10437.jpg,Topwear,Flying Machine Men HS Green Shirts Green
24602,24602.jpg,Topwear,BIba Women Blue Printed Kurta Blue
32767,32767.jpg,Topwear,John Miller Men Striped White Shirt White
56222,56222.jpg,Loungewear and Nightwear,SDL by Sweet Dreams Men Blue & Grey Pyjama Set Blue
37215,37215.jpg,Topwear,United Colors of Benetton Men Grey Shirt Grey
14097,14097.jpg,Topwear,Flying Machine Men Blue Polo Tshirts Blue
53750,53750.jpg,Bottomwear,ADIDAS Women Dark Grey Track Pant Grey
52682,52682.jpg,Watches,Morellato Men Silver Dial Watch Silver
15145,15145.jpg,Topwear,Arrow Sport Men Printed Navy Blue Shirts Navy Blue
45635,45635.jpg,Innerwear,Park Avenue Men White Briefs FB003 White
4512,4512.jpg,Shoes,Lotto Women Osaka Grey Violet Shoe Grey
7397,7397.jpg,Shoes,Red Tape Men's Black Formal Shoe Black
35542,35542.jpg,Sandal,Enroute Kids Girls Pink Sandals Pink
26969,26969.jpg,Topwear,Jealous 21 Women Printed White & Blue Top White
51007,51007.jpg,Innerwear,Enamor Black Full Figure Bra Black
48916,48916.jpg,Jewellery,Lucera Women Silver Pendant Silver
17612,17612.jpg,Topwear,Doodle Cute Girls  Grey Tshirt Grey
47162,47162.jpg,Belts,Peter England Men Brown Belt Brown
6245,6245.jpg,Topwear,UCB Men's Contrast Logo Grey T-shirt Grey
19788,19788.jpg,Topwear,U.S. Polo Assn. Men Solid Green Tshirt Green
12360,12360.jpg,Topwear,Reid & Taylor Men Solid Black Shirts Black
26155,26155.jpg,Bottomwear,John Miller Men Striped Grey Trousers Grey
3737,3737.jpg,Headwear,Lotto Unisex Kochi Tuskers Sovenior Purple Orange Cap Purple
42410,42410.jpg,Innerwear,Basics Men White Hip Brief White
29921,29921.jpg,Watches,Police Men Black Dial Chronograph Watch PL12777JS-02M Metal Black
27087,27087.jpg,Topwear,Aneri Women Egyptian Black Kurta Black
54575,54575.jpg,Topwear,Sushilas Women Printed Maroon Kurta Maroon
32303,32303.jpg,Watches,Q&Q Men Black Dial Watch Black
56646,56646.jpg,Topwear,Mumbai Slang Women White Kurti White
5898,5898.jpg,Shoes,Puma Men Tekkies Jam Blue Shoe Blue
57794,57794.jpg,Skin Care,Lotus Herbals Pomegranate & Plum Energizing Skin Polisher Maroon
10053,10053.jpg,Topwear,Gini And Jony Vini Romper Pink T-Shirts Pink
24266,24266.jpg,Topwear,Quiksilver Men Red T-shirt Red
38639,38639.jpg,Topwear,Nike Men Blue Cricket Blue Polo Tshirt Blue
15521,15521.jpg,Flip Flops,Rockport Men Jelbalp Black Flip Flops Black
45251,45251.jpg,Watches,Casio Youth Series Men Digital Watch W-734-1AVDF(D090) Synthetic Black
37671,37671.jpg,Bags,American Tourister Unisex Black Backpack Black
44383,44383.jpg,Fragrance,Spinz Women Exotic Deo Pink
23043,23043.jpg,Bottomwear,Arrow Woman Blue Jeggings Blue
17276,17276.jpg,Topwear,U.S. Polo Assn. Men Printed Mustard Tshirt Mustard
47506,47506.jpg,Innerwear,Facit Men Blue Innerwear Vest Blue
6621,6621.jpg,Shoes,ADIDAS Men's Boris Black Shoe Black
51463,51463.jpg,Topwear,Tonga Women Black Top Black
42848,42848.jpg,Wallets,French Connection Women Brown Wallet Brown
22191,22191.jpg,Shoes,Timberland Men Light Brown Casual Shoes Brown
9669,9669.jpg,Topwear,Indigo Nation Men Checks Blue Shirts Blue
54111,54111.jpg,Shoes,Rocia Women Copper Flats Copper
12704,12704.jpg,Shoes,Nike Men Air Relentness Grey Sports Shoes Grey
26531,26531.jpg,Shoes,Gas Men Arunta Olive Casual Shoes Olive
31586,31586.jpg,Topwear,Mark Taylor Men Printed Yellow T-shirt Yellow
3353,3353.jpg,Topwear,Myntra Men's I am a nice guy Navy Blue T-shirt Blue
42074,42074.jpg,Wallets,American Tourister Men Black Coin Passcase Wallet Black
47734,47734.jpg,Bags,Murcia Women Grey Handbag Grey
6413,6413.jpg,Shoes,Lotto Unisex Canvas Pink Shoe Pink
18830,18830.jpg,Belts,Peter England Men Formal Black Belt Black
28699,28699.jpg,Topwear,W Women Printed  Light Pink Kurta Pink
23271,23271.jpg,Watches,Maxima Ssteele Men White Watch White
17044,17044.jpg,Sandal,Gas Men Aventura Sandal Brown
50783,50783.jpg,Shoes,Clarks Women Black Onslow Beat Leather Wedges Black
51651,51651.jpg,Watches,Fossil Men Grey Dial Chronograph Watch FS4584 Stainless Steel Grey
16196,16196.jpg,Topwear,Puma Men Heroes Red Jackets Red
35314,35314.jpg,Jewellery,Fabindia Women Anusuya Silver Earrings Silver
43394,43394.jpg,Wallets,Lino Perros Men Brown Wallet Brown
17878,17878.jpg,Innerwear,Levis Men Comfort Style Maroon Innerwear Vest Maroon
30666,30666.jpg,Eyewear,Park Avenue Men Black Sunglasses Black
3161,3161.jpg,Shoes,Nike Men's Air Citius MSL White Grey Shoe White
8589,8589.jpg,Topwear,Scullers Men Scul Blue Shirts Blue
12536,12536.jpg,Topwear,Puma Women Solid Black Sweatshirts Black
26703,26703.jpg,Shoes,Nike Men White Court Shuttle Shoes White
25186,25186.jpg,Bags,Lino Perros Women Leatherette Brown Handbag Brown
56474,56474.jpg,Nails,Streetwear Fiery Femme Nail Polish # 18 Red
1636,1636.jpg,Shoes,Nike Men Air Zoom Century Shoes White
40511,40511.jpg,Watches,Titan Men White Dial Watch White
10261,10261.jpg,Bottomwear,John Miller Men Slim Brown Trousers Brown
24054,24054.jpg,Topwear,Locomotive Men Printed Blue T-shirt Blue
4344,4344.jpg,Shoes,Fila Men's Abascuss White Blue Shoe White
21526,21526.jpg,Bags,Kiara Women Glossy Red Handbag Red
15713,15713.jpg,Shoes,Nike Men Air Relentless Black Sports Shoes Black
53106,53106.jpg,Jewellery,Fabindia Silver Earrings Silver
5296,5296.jpg,Sandal,Puma Men Black Floater Black
24868,24868.jpg,Wallets,Reid & Taylor Men Casual Black Wallet Black
41605,41605.jpg,Topwear,Basics Men Grey Shirt Grey
25340,25340.jpg,Innerwear,Levis Men Beige Boxer Trunks Beige
11175,11175.jpg,Topwear,Scullers Men Stripes White Sweaters White
57760,57760.jpg,Skin Care,Lotus Herbals Tea Tree Face Wash White
24292,24292.jpg,Socks,Quiksilver Men High Black Socks Black
33225,33225.jpg,Dress,Sepia Women Pink Dress Pink
11949,11949.jpg,Shoes,Ganuchi Men Casual Brown Casual Shoes Brown
36757,36757.jpg,Watches,Maxima Women Black Watch Black
37685,37685.jpg,Bags,American Tourister Unisex Black Backpack Black
5050,5050.jpg,Shoes,Fila Men's Passion Black red Canvas Shoe Black
44377,44377.jpg,Fragrance,Jovan Men White Musk Deo Grey
58728,58728.jpg,Topwear,Puma Women Pink T-shirt Pink
50545,50545.jpg,Innerwear,Chromozome Men Pack of Two Briefs Black
17282,17282.jpg,Topwear,U.S. Polo Assn. Men Printed Black Tshirt Black
34000,34000.jpg,Topwear,Femella Women Black Top Black
7707,7707.jpg,Bottomwear,Jealous 21 Women's Abbie Black Jegging Black
46420,46420.jpg,Watches,Timex Men Cream Dial Chronograph Watch Cream
16350,16350.jpg,Topwear,Peter England Men Stripes Cream Shirt Cream
51497,51497.jpg,Bottomwear,Denizen Women Navy Blue Jeans Navy Blue
22165,22165.jpg,Shoes,Timberland Men Brown Casual Shoes Brown
43152,43152.jpg,Watches,Fastrack Men Black Watch Black
2275,2275.jpg,Topwear,Nike Mens Challenger Graphic White T-shirt White
27417,27417.jpg,Bottomwear,Jockey Women Blue Relaxed Capris Blue
55037,55037.jpg,Lips,Lakme Absolute Matte Bitter Chocolate Lipstick 53 Brown
19318,19318.jpg,Bags,Nike Unisex Classic Base Blue Backpack Blue
49468,49468.jpg,Shoes,Vans Men Red Old Skool Shoes Red
42080,42080.jpg,Wallets,American Tourister Men Black Travel Wallet Black
22959,22959.jpg,Shoes,Reebok Men White Fusion Sports Shoes White
34232,34232.jpg,Topwear,Proline Men Grey T-shirt Grey
23285,23285.jpg,Watches,Maxima Men White Watch White
50777,50777.jpg,Shoes,Clarks Men Dino Limit Brown Formal Shoes Brown
16162,16162.jpg,Sandal,Enroute Men Leather Black Sandals Black
22357,22357.jpg,Topwear,John Players Men Solid Black Shirt Black
19916,19916.jpg,Bags,Wildcraft Unisex Black & Grey Printed Laptop Backpack Black
7535,7535.jpg,Topwear,Nike Men's Blue Polo T-shirt Blue
46612,46612.jpg,Shoes,Catwalk Women Brown Wedges Brown
27625,27625.jpg,Bottomwear,Scullers Men Grey Shorts Grey
13410,13410.jpg,Topwear,United Colors of Benetton Men Solid Blue Shirts Blue
48788,48788.jpg,Jewellery,Lucera Women Silver Pendant Silver
43360,43360.jpg,Shoes,Reebok Men White Ultimate Vibe Sports Shoes White
2047,2047.jpg,Topwear,ADIDAS Men's Navy Blue T-shirt Navy Blue
30692,30692.jpg,Shoes,Catwalk Women Brown Heels Brown
55205,55205.jpg,Lips,Lakme Lip Love Dark Desire Lipstick B122A Brown
25172,25172.jpg,Bags,Lino Perros Women Leatherite Brown Handbag Brown
56480,56480.jpg,Nails,Streetwear Chocolat Nail Polish 20 Brown
11347,11347.jpg,Bottomwear,Lee Men Elvira Rinse Blue Chicago Fit Jeans Blue
41437,41437.jpg,Shoes,Lee Cooper Men White Sports Shoes White
33017,33017.jpg,Topwear,Mother Earth Women Striped Green Kurta Green
10295,10295.jpg,Shoes,Clarks Men Brown Leather Casual Shoes Synthetic Brown
57552,57552.jpg,Lips,Lotus Herbals Floralstay Copper Toast Lip Color 424 Copper
44979,44979.jpg,Watches,Maxima Attivo Men Steel-Toned Dial Watch 15933LMGB Leather Silver
45097,45097.jpg,Innerwear,Bwitch Pink Ruby Bra Pink
36565,36565.jpg,Fragrance,United Colors of Benetton Women Deo Red
14635,14635.jpg,Mufflers,United Colors of Benetton Men Solid Black Mufflers Black
5262,5262.jpg,Bags,Wildcraft Unisex Blue & Grey Printed Backpack Blue
8925,8925.jpg,Belts,Puma Men High Shine Black Belt Black
16506,16506.jpg,Bottomwear,Locomotive Men Washed Blue Jeans Blue
22733,22733.jpg,Shoes,Nike Men Dunk High Grey Casual Shoes Grey
35784,35784.jpg,Shoes,Enroute Women Black Shoes Black
7151,7151.jpg,Topwear,Scullers For Her Women Rivited Check Black Shirts Black
46276,46276.jpg,Topwear,109F Women Cream Printed Top Cream
13848,13848.jpg,Topwear,United Colors of Benetton Men Solid Blue Polo Tshirts Blue
6083,6083.jpg,Topwear,UCB Women's Halftone Print Pink T-shirt Pink
28209,28209.jpg,Eyewear,Ray-Ban Men High Street Black Sunglasses Black
50313,50313.jpg,Ties,Park Avenue Men Brown Tie Brown
8119,8119.jpg,Belts,Fastrack Men Canvas Red Stitches Grey Belts Grey
31324,31324.jpg,Topwear,Aurelia Women Printed Blue Kurta Blue
13074,13074.jpg,Shoes,Numero Uno Men Brown Casual Shoes Brown
43704,43704.jpg,Jewellery,Royal Diadem Green Earring & Pendant Set Green
33473,33473.jpg,Belts,Baggit Women Choti Jhuti Brown Belt Brown
58942,58942.jpg,Watches,Tommy Hilfiger Women Silver-Toned Dial  Watch TH1780453-D Metal Silver
20858,20858.jpg,Eyewear,United Colors of Benetton Women Casual Olive Sunglasses Olive
40181,40181.jpg,Eyewear,Fastrack Men Revo Coated Sporty Wrap Sunglasses Grey
57136,57136.jpg,Bottomwear,Elle Women Black Trousers Black
25516,25516.jpg,Topwear,Doodle Kids Boys Airfeild Red T-Shirt Red
39149,39149.jpg,Topwear,Aneri Women Red Kurtas Red
59890,59890.jpg,Topwear,Femella Women Multi Coloured Tunic Multi
53596,53596.jpg,Free Gifts,Q&Q Men Navy Blue Digital Watch Navy Blue
20064,20064.jpg,Mufflers,United Colors Of Benetton Women Blue Muffler Blue
5606,5606.jpg,Sandal,ADIDAS Men Kendall Black Floater Black
44521,44521.jpg,Sandal,Coolers Men Black Sandals Black
36101,36101.jpg,Wallets,OTLS Men Josh Brown Wallet Brown
52444,52444.jpg,Loungewear and Nightwear,Red Rose White & Purple Nightdress Purple
39975,39975.jpg,Shoes,Gas Men Olive Swansea Shoes Synthetic Olive
57304,57304.jpg,Shoes,Rocia Women Brown Wedges Brown
33641,33641.jpg,Flip Flops,Lotto Men Black Koro G Slippers Black
41261,41261.jpg,Wallets,Arrow Men Brown Wallet Brown
25724,25724.jpg,Belts,Wrangler Men Leather Brown Belt Brown
11511,11511.jpg,Shoes,Catwalk Women Lifestyle Gold Toned Ballerinas Gold
5434,5434.jpg,Topwear,Nike Men's Kill Man Red T-shirt Red
44713,44713.jpg,Flip Flops,Lotto Men Black Flip Flops Black
14063,14063.jpg,Topwear,Flying Machine Men Solid Blue Polo Tshirts Blue
20256,20256.jpg,Topwear,Wrangler Men Wing Green T-shirt Green
52676,52676.jpg,Free Gifts,Morellato Women White Dial Watch White
36333,36333.jpg,Socks,Playboy Men White & Red Socks White
7363,7363.jpg,Shoes,Red Tape Men Black Semi Formal Shoes Black
46044,46044.jpg,Jewellery,Estelle Gold Earrings Gold
16734,16734.jpg,Flip Flops,Lotto Men Emeriti Maroon Slipper Maroon
22501,22501.jpg,Shoes,Catwalk Women Beige Casual Shoes Synthetic Beige
49830,49830.jpg,Flip Flops,iPanema Women Pink Flip Flops Pink
47196,47196.jpg,Sandal,Franco Leone Men Brown Sandals Brown
34464,34464.jpg,Accessories,ADIDAS Unisex Red Organizer Bag Red
12394,12394.jpg,Socks,Reid & Taylor Men Solid Black Socks Black
46878,46878.jpg,Socks,Lino Perros Men Pack of 2 Socks Black
31116,31116.jpg,Bottomwear,Gini and Jony Boys Grey Shorts Grey
43536,43536.jpg,Topwear,French Connection Women Peach Top Peach
28807,28807.jpg,Topwear,Denizen Men Check Brown Shirt Brown
2611,2611.jpg,Shoes,Carlton London Women Stylish Gold Flats Gold
13246,13246.jpg,Bottomwear,Palm Tree Kids Boy Washed Blue Jeans Blue
54581,54581.jpg,Topwear,Sushilas Women Printed Green Kurta Green
3763,3763.jpg,Topwear,Status Quo Men's London Icon Grey T-shirt Grey
29975,29975.jpg,Free Gifts,Aspen Women Black Dial Watch Black
26101,26101.jpg,Topwear,John Miller Men Striped White Shirt White
54521,54521.jpg,Shoes,F Sports Men White Voyager Sports Shoes White
9259,9259.jpg,Topwear,Mark Taylor Men Blue Striped Shirt Blue
30064,30064.jpg,Watches,Ed Hardy Men Grey Dial Watch Black
16794,16794.jpg,Topwear,Highlander Men Stripes Navy Blue Shirt Navy Blue
51053,51053.jpg,Innerwear,Enamor Women Green Bikini Brief Green
49890,49890.jpg,Watches,Q&Q Kids Girls Blue Analog Watch Blue
47136,47136.jpg,Bags,Be For Bag Women Blue Tote Bag Blue
6211,6211.jpg,Topwear,UCB Women's Print Boat Blue Top Blue
48942,48942.jpg,Jewellery,Lucera Women Silver Ring Silver
23473,23473.jpg,Scarves,Lino Perros Men Red Check Scarf Red
50181,50181.jpg,Makeup,Peperone Women Beige Handbag Beige
17646,17646.jpg,Flip Flops,Converse Unisex Green Flip Flops Synthetic Green
30858,30858.jpg,Topwear,Fabindia Women Striped Black Kurta Black
1808,1808.jpg,Water Bottle,Quechua Aluminium Print Water Bottle Purple
37241,37241.jpg,Shoes,United Colors of Benetton Men Black Shoes Black
5494,5494.jpg,Topwear,Mr.Men Men's Charcoal Polo T-shirt Grey
45661,45661.jpg,Innerwear,Park Avenue Men Grey Melange Square Neck Vest Grey Melange
36393,36393.jpg,Socks,Reid & Taylor Men Blue Socks Blue
4546,4546.jpg,Shoes,Nike Men's Air Max Black Shoe Black
21324,21324.jpg,Eyewear,Louis Philippe Men Aviator Sunglasses LP201-C1 Metal Brown
15111,15111.jpg,Bottomwear,Arrow Men Stripes Coffee Brown Trousers Coffee Brown
38209,38209.jpg,Eyewear,Polaroid Women Sunglasses Silver
40313,40313.jpg,Sandal,Warner Bros Kids White sandals White
10463,10463.jpg,Topwear,Flying Machine Men Grey Polo Tshirts Grey
24656,24656.jpg,Socks,ADIDAS Originals Boys White Pack of 3 Casual Socks White
25784,25784.jpg,Topwear,Arrow Men Light Brown Suspenders Brown
56276,56276.jpg,Innerwear,Biara Women Skin Bra Skin
37073,37073.jpg,Bags,Lino Perros Women Purple Handbag Purple
44581,44581.jpg,Bottomwear,Lee Rinse Navy Blue Slim Fit Jeans Navy Blue
53536,53536.jpg,Innerwear,Amante Women Pack of 3 Assorted Briefs PFCP11 Multi
21116,21116.jpg,Topwear,s.Oliver Women Faded Lilac Top Lavender
15323,15323.jpg,Topwear,Nike Men Solid Grey Jacket Grey
56878,56878.jpg,Shoes,HM Women Silver Heels Silver
4774,4774.jpg,Bottomwear,ADIDAS Women 3S Pink Track Pants Pink
57196,57196.jpg,Topwear,Elle Women Red Tunic Red
40121,40121.jpg,Socks,ADIDAS Unisex Pack of 3 Socks White
32501,32501.jpg,Topwear,Scullers Men Black Shirt Black
56044,56044.jpg,Lips,Colorbar Full Finish Longwear Kiss Me Lipstick 07 Brown
11783,11783.jpg,Topwear,Lee Men Printed Grey Tshirts Grey
12106,12106.jpg,Topwear,W Women Printed White Kurtis White
26333,26333.jpg,Watches,DKNY Women White Dial Watch NY4934 Stainless Steel White
3551,3551.jpg,Shoes,Skechers Men's Charcoal Lifestyle Shoe Synthetic Brown
42676,42676.jpg,Topwear,Alma Women Black Kurta Black
2483,2483.jpg,Topwear,Puma Women Spagetti Dahlia Purple Top Purple
30256,30256.jpg,Shoes,Red Tape Men Black Semi Formal Shoes Black
54713,54713.jpg,Apparel Set,Shree Women Cream-Coloured & Pink Printed Salwar Suit with Dupatta Cream
51261,51261.jpg,Belts,Park Avenue Men Black & Brown Reversible Belt Black
9857,9857.jpg,Topwear,Status Quo Men Green Polo Tshirts Green
47304,47304.jpg,Bags,Baggit Women Green purse Green
6023,6023.jpg,Topwear,UCB Men's Johny Collar With Two Tone Green T-shirt Green
21572,21572.jpg,Socks,Lino Perros Men Pack of Five Striped Socks Multi
15747,15747.jpg,Shoes,Nike Men Ballista SL White Sports Shoes White
32959,32959.jpg,Topwear,Angry Birds Men Purple T-shirt Purple
52080,52080.jpg,Topwear,Myntra Men Navy Blue T-shirt Navy Blue
59468,59468.jpg,Jewellery,Lucera Silver Ring Silver
45037,45037.jpg,Watches,Maxima Attivo Men White Dial Watch White
4310,4310.jpg,Topwear,Tantra Kid's Unisex Papa's Joy Green Kidswear Green
37417,37417.jpg,Bags,Murcia Women Jute Silver Handbag Silver
53152,53152.jpg,Topwear,Mark Taylor Men Brown Shirt Brown
14695,14695.jpg,Bottomwear,Basics Men Black Trousers Black
32165,32165.jpg,Socks,Playboy Women Playmate Pink Ankle Socks Pink
56420,56420.jpg,Innerwear,Biara Women White Bra White
10235,10235.jpg,Watches,Carrera Men Hexagaon Dial Black Watches Black
1662,1662.jpg,Topwear,Nike Men Blue Windrunner Jacket Navy Blue
40545,40545.jpg,Watches,Titan Raga Women Gold Watch Gold
48728,48728.jpg,Jewellery,Lucera Women Silver Earrings Silver
30632,30632.jpg,Topwear,Nike Men Challenger Spiked Yellowish Green T-shirt Yellow
27685,27685.jpg,Bags,Murcia Women Purple Handbag Purple
18058,18058.jpg,Wallets,Lino Perros Women Solid Purple Wallet Purple
3135,3135.jpg,Shoes,Catwalk Women Heeded Golden Strap Black Heels Gold
42212,42212.jpg,Topwear,Sepia Women Pink Tunic Pink
23225,23225.jpg,Topwear,Aneri Women Tibett Pink Kurta Pink
17010,17010.jpg,Shoes,Rocia Women Brown Heels Brown
18864,18864.jpg,Topwear,Puma Men Sports Division Black Sweatshirt Black
34292,34292.jpg,Topwear,Fabindia Women Multi Coloured Chanderi Dupatta Multi
6447,6447.jpg,Flip Flops,Lotto Women's Cross Color Black Pink Flip Flop Black
7595,7595.jpg,Shoes,Nike Women Ten Blue White Shoe Blue
3909,3909.jpg,Bottomwear,Urban Yoga Women Yoga Red Capri Red
51605,51605.jpg,Bottomwear,Kraus Jeans Women Black Trousers Black
13682,13682.jpg,Shoes,ADIDAS Women Duramo 3 Sports Shoes Silver
54145,54145.jpg,Shoes,Rocia Women Brown Flats Brown
3307,3307.jpg,Shoes,Asics Men's Gel Phoenix 3 Black Silver Shoe Black
42020,42020.jpg,Shoes,ADIDAS Men Brown Mudslide Shoes Brown
55097,55097.jpg,Skin,Pond's Gold Radiance Precious Youth Serum Gold
12750,12750.jpg,Bags,Nike Unisex Swoosh Black Backpacks Black
47552,47552.jpg,Shoes,Portia Women Brown Heels Brown
54979,54979.jpg,Topwear,Femella Women White Printed Shirt White
6675,6675.jpg,Shoes,Nike Men's Free White Grey Shoe White
17222,17222.jpg,Eyewear,United Colors of Benetton Men Funky Eyewear Blue Sunglasses Blue
51437,51437.jpg,Topwear,Myntra Women Multi Coloured Printed Top Peach
35172,35172.jpg,Bags,Wildcraft Unisex Cruiser Red Backpack Red
46480,46480.jpg,Watches,Timex Women Steel Watch Steel
45205,45205.jpg,Watches,CASIO ENTICER Women Black Dial Analogue Watch A660 Metal Black
4122,4122.jpg,Shoes,Puma Unisex Lo Punk Black Yellow Shoe Black
21740,21740.jpg,Shoes,Vans Unisex Authentic Lo Pro Brown Casual Shoes Brown
15575,15575.jpg,Topwear,Chhota Bheem Kids Boys Best Friends Group TShirt Yellow
53360,53360.jpg,Wallets,Puma Woman Pink Big Cat Wallet Pink
37625,37625.jpg,Topwear,Madagascar3 Boys White Printed T-Shirt White
56612,56612.jpg,Makeup,Streetwear True Color Claret Tint Blusher Peach
32357,32357.jpg,Watches,Q&Q Men Black Dial Watch Synthetic Black
33285,33285.jpg,Topwear,Arrow Sport Men Striped Blue Polo T-shirt Blue
40777,40777.jpg,Flip Flops,Quiksilver Men White Flip Flops White
10007,10007.jpg,Topwear,Nike Women As Trophy Swo White T-Shirts White
21586,21586.jpg,Bottomwear,Locomotive Men Washed Grey Jeans Grey
52074,52074.jpg,Topwear,Myntra Men Yellow & Blue T-shirt Yellow
14661,14661.jpg,Topwear,Basics Men Navy Slim Fit Checked Shirt Navy Blue
20454,20454.jpg,Belts,Baggit Women Poppins Doko Teal Blue Belt Teal
32191,32191.jpg,Shoes,ADIDAS Men Phantom Blue Sports Shoes Blue
52848,52848.jpg,Jewellery,Adrika Women Green Earrings Green
39579,39579.jpg,Shoes,Catwalk Women Multi Colour Flats Multi
25126,25126.jpg,Bags,Lino Perros Women Black Clutch Black
57506,57506.jpg,Sandal,Lee Cooper Men Brown Sandals Brown
33043,33043.jpg,Topwear,Mother Earth Women Printed Blue Kurta Blue
43334,43334.jpg,Bags,Murcia Women Maroon Handbag Maroon
27671,27671.jpg,Bags,Murcia Women Pink Handbag Pink
54383,54383.jpg,Wallets,Baggit Women Green Wallet Green
13444,13444.jpg,Topwear,United Colors of Benetton Women Printed Yellow Tops Yellow
55251,55251.jpg,Makeup,Lakme Absolute Moonlit Highlighter Face Brightener 9G Skin
31714,31714.jpg,Jewellery,Fabindia Women Anusuya Silver Earrings Silver
8529,8529.jpg,Shoes,Nike Men Nike Lunarfly+  2 Navy Blue Sports Shoes Navy Blue
28639,28639.jpg,Topwear,Nike Men White T-shirt White
50723,50723.jpg,Dress,Doodle Girls Blue Printed Dress Blue
47794,47794.jpg,Bags,Murcia Women Brown Handbag Brown
34266,34266.jpg,Topwear,Fabindia Women Brown Silk Dupatta Brown
18890,18890.jpg,Topwear,Arrow Woman Tyra Purple Shirt Purple
7561,7561.jpg,Topwear,Nike Men's As Spher White T-shirt White
19942,19942.jpg,Bags,Nike Unisex Casual Black Duffle Bag Black
46646,46646.jpg,Fragrance,Rasasi Men Deserve Deo Blue
16136,16136.jpg,Topwear,Tokyo Talkies Women Printed Blue Top Blue
27443,27443.jpg,Topwear,Jockey Women Pink T-Shirt Pink
13676,13676.jpg,Shoes,ADIDAS Men Titan Sports Shoes Silver
43106,43106.jpg,Fragrance,Reebok Men Reespark Deo Yellow
2221,2221.jpg,Bags,ADIDAS Classic Blue White Backpack Blue
55063,55063.jpg,Lips,Lakme Enrich Satins Lipstick 421 Brown
26591,26591.jpg,Flip Flops,Puma Men Aqua Cat II Power Red Flip Flops Red
6681,6681.jpg,Shoes,Nike Women's Izanami White Blue Shoe White
34054,34054.jpg,Bottomwear,Palm Tree Boys Washed Blue 3/4 Length Pants Blue
22131,22131.jpg,Shoes,Provogue Men Black Formal Shoes Black
7753,7753.jpg,Shoes,Fila Men's Victory Black Shoe Black
35186,35186.jpg,Bags,Wildcraft Unisex Grey & Black Backpack Grey
46474,46474.jpg,Watches,Timex Men Black Dial Watch L506 Metal Black
36703,36703.jpg,Fragrance,Yves Saint Laurent Men Body Kouros Perfume Black
15581,15581.jpg,Topwear,Proline Men Purple Polo T-shirt Purple
14453,14453.jpg,Shoes,Enroute Women Casual Black Flats Black
53394,53394.jpg,Topwear,Alma Women Blue and Sea Green Printed Kurta Blue
20666,20666.jpg,Topwear,Classic Polo Men Striped Grey Tshirt Grey
5004,5004.jpg,Bottomwear,Gini and Jony Girl's Delma Blue Kidswear Blue
25314,25314.jpg,Watches,Casio Youth Series Men Digital Watch AE-1100W-1BVDF(D086) Synthetic Black
11121,11121.jpg,Headwear,Puma Women Minicats Knit Blue Cap Blue
33271,33271.jpg,Bottomwear,Gini and Jony Girls Red Skirt Red
40783,40783.jpg,Flip Flops,Quiksilver Men Black Flip Flops Black
5838,5838.jpg,Topwear,ADIDAS Men's Graphic White T-shirt White
57734,57734.jpg,Lips,Lotus Herbals Fruity Fusion Lip Balm Maroon
31142,31142.jpg,Topwear,John Miller Men Check Orange Shirt Orange
3797,3797.jpg,Shoes,Converse Men Black & Red Shoes Black
29981,29981.jpg,Free Gifts,Aspen Women Blue Dial Watch Blue
19728,19728.jpg,Topwear,United Colors of Benetton Women Solid Purple Shirt Purple
55407,55407.jpg,Lips,Revlon ColorStay Overtime Relentless Raisin Lip Gloss 270 Purple
27027,27027.jpg,Bottomwear,Jealous 21 Women Blue Shorts Blue
13212,13212.jpg,Shoes,ASICS Women Gel Spree Running Grey Sports Shoes Grey
28853,28853.jpg,Topwear,Proline Men Purple T-shirt Purple
43562,43562.jpg,Socks,Puma Men White Pack of 3 Socks White
50949,50949.jpg,Bottomwear,Lee Women Navy Blue Roxy Fit Jeans Navy Blue
30090,30090.jpg,Watches,Ed Hardy Men Silver Dial Watch Steel
2645,2645.jpg,Bags,Murcia Women Big Canvas Tote Bag Pink
16760,16760.jpg,Bags,Spice Art Women Leatherette  Black Handbags Black
49864,49864.jpg,Watches,Q&Q Kids Unisex Purple Digital Watch Purple
22555,22555.jpg,Fragrance,Reebok Men Reespeed Deo Black
46010,46010.jpg,Saree,Fabindia Maroon Printed Saree Maroon
34430,34430.jpg,Topwear,Myntra Women Face Blue T-shirt Blue
23487,23487.jpg,Scarves,Arrow Men Grey Scarf Grey
50175,50175.jpg,Shoes,Rocia Women Black & Brown Flats Black
58318,58318.jpg,Socks,Jockey LCESCBRA Men White Pack of 3 Socks 2004 White
14037,14037.jpg,Topwear,Flying Machine Men Check Blue Shirts Blue
20202,20202.jpg,Topwear,Wrangler Men Glow Grey Sweatshirt Grey
5460,5460.jpg,Shoes,Nike Women's Double Team Lite Black Shoe Black
44747,44747.jpg,Shoes,Globalite Men Black Sparta Shoes Black
36367,36367.jpg,Ties,Reid & Taylor Men Red Tie Red
52622,52622.jpg,Bags,Mod-acc Women Purple Handbag Purple
57350,57350.jpg,Innerwear,Amante Black T-Shirt Bra BGSB01 Black
