id,filename,subCategory,query
42812,42812.jpg,Innerwear,Little Miss Intimates Women Grey Brief Grey
29523,29523.jpg,Watches,Playboy Women White Dial Watch White
54977,54977.jpg,Loungewear and Nightwear,Femella Women Blue Lounge Pants Blue
10835,10835.jpg,Topwear,Wrangler Men Black Polo Tshirts Black
59654,59654.jpg,Saree,FNF Purple Evening Wear Sari Purple
10009,10009.jpg,Topwear,Nike Men Town Round Red Neck T-Shirts Red
38663,38663.jpg,Shoes,Nike Men Downshifter Black Sports Shoes Black
40779,40779.jpg,Flip Flops,Quiksilver Men Brown Flip Flops Brown
32359,32359.jpg,Watches,Q&Q Men Black Dial Watch Synthetic Black
4910,4910.jpg,Topwear,Levis Kids Girl's Dionne Pink Teens Kidswear Pink
43598,43598.jpg,Topwear,Angry Birds Men Charcoal T-shirt Charcoal
48170,48170.jpg,Wallets,Fossil Women Blue Floral Print Wallet Blue
9257,9257.jpg,Topwear,Mark Taylor Men Blue Striped Shirt Blue
18600,18600.jpg,Shoes,Puma Women Roque Grey Sandals Grey
8385,8385.jpg,Topwear,Doodle Girl's Hippie Chic Orange Teen Kidswear Orange
28095,28095.jpg,Innerwear,Jockey MC Men Grey Melange Y Front Briefs 8003 Grey Melange
17648,17648.jpg,Flip Flops,Converse Unisex Black Flip Flops Synthetic Black
30856,30856.jpg,Topwear,Fabindia Women Green Bijli Print Khadi Kurta Green
47138,47138.jpg,Bags,Be For Bag Women Combo pack Tote Bags White
26933,26933.jpg,Topwear,Jealous 21 Women Black Top Black
31984,31984.jpg,Bags,ADIDAS Unisex Black Backpack Black
29147,29147.jpg,Topwear,United Colors of Benetton Men Printed Green T-shirt Green
59230,59230.jpg,Watches,Titan Men Black Watch Synthetic Black
4548,4548.jpg,Shoes,Nike Women Sweet AC Black Shoe Black
1806,1806.jpg,Sandal,Quechua Men Arpenaz Brown Sandal Brown
15923,15923.jpg,Bags,ADIDAS Unisex ADP1810 Black Backpack Black
56278,56278.jpg,Innerwear,Biara Skin Coloured Everyday Support Bra MW 1002 Skin
24658,24658.jpg,Socks,ADIDAS Originals Men Pink Casual Socks Pink
38207,38207.jpg,Eyewear,Polaroid Women Sunglasses Silver
56876,56876.jpg,Shoes,HM Women Blue Heels Blue
21118,21118.jpg,Topwear,s.Oliver Men Check Olive Shirt Olive
59002,59002.jpg,Fragrance,Brut Men Alaska Deo Blue
53538,53538.jpg,Innerwear,Amante Women Pack of 3 Assorted Briefs PFCP13 Multi
36993,36993.jpg,Bags,Lino Perros Women Black Handbag Black
21924,21924.jpg,Apparel Set,Biba Women Black Printed Churidar Kurta with Dupatta Black
38035,38035.jpg,Watches,Q&Q Men White Watch White
57198,57198.jpg,Topwear,Elle Women Multi Coloured Top Multi
18432,18432.jpg,Bags,Vital Gear Unisex Pink Daypack Backpack Pink
6811,6811.jpg,Shoes,Timberland Men's Ox Maroon Red Shoe Red
48342,48342.jpg,Jewellery,Pitaraa Silver Fish Scale Necklace Silver
9065,9065.jpg,Topwear,Mark Taylor Men Blue Striped Shirt Blue
30258,30258.jpg,Shoes,Red Tape Men Brown Shoes Brown
42678,42678.jpg,Topwear,Alma Women Navy Blue Printed Kurta Navy Blue
49290,49290.jpg,Socks,Arrow Men Black Pack of 5 Plating Design Socks Black
12108,12108.jpg,Topwear,W Women Printed Pink Kurtis Blue
9859,9859.jpg,Topwear,Status Quo Men Pink Polo Tshirts Pink
12934,12934.jpg,Topwear,Classic Polo Men Rugby Scrum Blue Tshirts Blue
55293,55293.jpg,Lips,Lakme Absolute Coralshine Plump & Shine Lip Gloss Peach
3103,3103.jpg,Topwear,Probase Men's Wtf Blue T-Shirt Navy Blue
42224,42224.jpg,Topwear,Sepia Women White Top White
9439,9439.jpg,Bags,Nike Unisex Brasilia 5 Me Blue Backpacks Blue
30604,30604.jpg,Bottomwear,Nike Men Classic Jersey Black Track Pants Black
54341,54341.jpg,Socks,Levis Men Pack of 3 Socks Black
13486,13486.jpg,Topwear,United Colors of Benetton Men Stripes White Shirts White
19980,19980.jpg,Topwear,United Colors of Benetton Men Printed Yellow TShirt Yellow
46684,46684.jpg,Fragrance,Rasasi Men Fighting Temptation Perfume Brown
51633,51633.jpg,Watches,Fossil Women White Dial Chronograph Watch ES2790 Leather White
29729,29729.jpg,Bags,Kiara Women Leatherette Green Handbag Green
23213,23213.jpg,Topwear,Aneri Women Gauri White Kurta White
17026,17026.jpg,Flip Flops,Gas Men Beach Flip Flops Blue
18852,18852.jpg,Topwear,Puma Men Head Navy Blue Tshirt Navy Blue
6471,6471.jpg,Topwear,ADIDAS Women's Polo Grey T-shirt Grey
37421,37421.jpg,Bags,Murcia Women Office Black Handbag Black
20496,20496.jpg,Wallets,Baggit Women Samson Cobra Pink Wallet Pink
21544,21544.jpg,Bags,Kiara Women Small Pocket Blue Handbag Blue
15771,15771.jpg,Innerwear,Facit Men Trophy BF Red Briefs Red
45001,45001.jpg,Watches,Maxima Men Black Digital Watch Grey
4326,4326.jpg,Topwear,Tantra Kid's Unisex Got It Pink Kidswear Pink
10203,10203.jpg,Bags,Murcia Women Hahk Red Handbags Red
24036,24036.jpg,Topwear,Locomotive Men Printed Red T-shirt Red
1654,1654.jpg,Shoes,Reebok Men's Frisker LP Shoe White
38469,38469.jpg,Wallets,Baggit Women Magenta Voltage Sapera Wallet Magenta
33081,33081.jpg,Topwear,U.S. Polo Assn. Denim Co. Men Navy Blue T-Shirt Navy Blue
40573,40573.jpg,Topwear,W Women Cream Kurta Cream
56416,56416.jpg,Innerwear,Biara Women Rose Red Bra Rose
14491,14491.jpg,Shoes,Flying Machine Men Casual Black Casual Shoes Black
37613,37613.jpg,Topwear,Madagascar3 Girls Purple Printed T-Shirt Purple
45233,45233.jpg,Watches,Casio Youth Series Men Analog-Digital Watch AW-80D-1AVDFAD60 Stainless Steel Black
4114,4114.jpg,Sandal,Fila Men Obsidian Black Sandal Black
15543,15543.jpg,Shoes,Catwalk Women Casual Brown Wedges Brown
40741,40741.jpg,Flip Flops,Converse Unisex Navy Blue Flip Flops Synthetic Navy Blue
10031,10031.jpg,Topwear,Nike Men As Arsenal Co Navy Blue T-Shirts Navy Blue
24204,24204.jpg,Bottomwear,Deni Yo Men Skinny Fit Blue Jeans Blue
56624,56624.jpg,Skin,Olay Women Age Protect Anti-Ageing UV Lotion Black
4928,4928.jpg,Topwear,Gini and Jony Girl's Venice Green Blue Infant Kidswear Green
41693,41693.jpg,Loungewear and Nightwear,Superman Men Blue Printed Lounge Pants Navy Blue
32361,32361.jpg,Watches,Q&Q Men Black Dial Watch Q672J405Y Metal Black
42016,42016.jpg,Shoes,ADIDAS Men Silver Phaedra Shoes Silver
12766,12766.jpg,Topwear,Spykar Men Stripe Navy Blue T-Shirts Navy Blue
26553,26553.jpg,Shoes,ID Men Blue Shoes Blue
27481,27481.jpg,Innerwear,Jockey Essence Beige Bra 2004 Beige
54173,54173.jpg,Jewellery,Femella Blue Necklace Blue
51401,51401.jpg,Topwear,Myntra Men Blue and Yellow Check Shirt Blue
35144,35144.jpg,Bags,Allen Solly Woman Black Clutch Black
7791,7791.jpg,Topwear,Proline Men's Polo Solid Olive T-shirt Green
47564,47564.jpg,Shoes,Portia Women Brown Sandals Brown
34096,34096.jpg,Topwear,Doodle Boys Printed Red T-shirt Red
6643,6643.jpg,Shoes,Nike Women's Transform III IN Black Pink Shoe Pink
17214,17214.jpg,Eyewear,United Colors of Benetton Women Funky Eyewear Black Sunglasses Black
45657,45657.jpg,Innerwear,Park Avenue Men Navy Blue Boxer Briefs Navy Blue
4570,4570.jpg,Shoes,Nike Women Iza Black Shoe Black
21312,21312.jpg,Eyewear,Celine Dion Women Brown Frame Sunglasses Brown
15127,15127.jpg,Bottomwear,Arrow Sport Men Solid  Brown Trousers Brown
53732,53732.jpg,Shoes,Puma Women Green Supersuede Eco Casual Shoes Green
44785,44785.jpg,Shoes,Lotto Men L500 FG White Sports Shoes White
11587,11587.jpg,Topwear,W Women Printed White Kurtis White
56240,56240.jpg,Loungewear and Nightwear,SDL by Sweet Dreams Men Grey & Blue Pyjama Set Navy Blue
40325,40325.jpg,Shoes,ADIDAS Men White Sport Shoes White
57392,57392.jpg,Innerwear,Amante Women Pack of 3 Printed Briefs PFCN04 White
10455,10455.jpg,Topwear,Flying Machine Men Mauvemist Purple Tshirts Pink
24660,24660.jpg,Socks,ADIDAS Originals Men Pink Casual Socks Pink
54517,54517.jpg,Shoes,F Sports Men White Bratt Sports Shoes White
18638,18638.jpg,Topwear,Puma Men V.11 Speed Black Tshirts Black
28891,28891.jpg,Innerwear,Enamor Women Beige Regular-Rise Brief Skin
48148,48148.jpg,Wallets,Fossil Women Red Wallet Red
2687,2687.jpg,Topwear,Inkfruit Women's Love Wood Orange T-shirt Orange
30052,30052.jpg,Watches,SKAGEN DENMARK Men Grey Dial Watch 668XLSLZM Synthetic Grey
3755,3755.jpg,Topwear,Status Quo Men's Concerts Black T-shirt Black
31180,31180.jpg,Bottomwear,Gini and Jony Kids Leggings White
29943,29943.jpg,Watches,Police Men Black Dual Dial Watch PL13076JPCL-04 Synthetic Black
47100,47100.jpg,Shoes,Marvel Boys Red Light Spidey Shoes Red
6227,6227.jpg,Topwear,Lee Men's Grey Yellowbrass T-shirt Yellow
17670,17670.jpg,Shoes,Catwalk Women Fancy Black Heels Black
22597,22597.jpg,Topwear,Nike Men Orange T-shirt Orange
43792,43792.jpg,Jewellery,Royal Diadem Gold & Pink Earrings Gold
30260,30260.jpg,Shoes,Red Tape Men Black Shoes Black
54725,54725.jpg,Topwear,Shree Women Coral Coloured Printed Kurta Pink
6829,6829.jpg,Shoes,Nike Women's Lunar Swift White Blue Shoe White
12130,12130.jpg,Topwear,Aurelia Women Printed Green Kurtas Green
26305,26305.jpg,Topwear,Proline Men Pack of 3 T-Shirts Cream
3567,3567.jpg,Shoes,ADIDAS Men's Silver White Running Shoe Silver
42640,42640.jpg,Topwear,W Women Red Dress Red
23677,23677.jpg,Sandal,Red Tape Men Cross Band Brown Sandals Brown
17442,17442.jpg,Watches,CASIO Unisex Black Small Dial Analogue and Digital Watch Synthetic Black
50385,50385.jpg,Bottomwear,Vishudh Women Pink Salwar and Dupatta Pink
47332,47332.jpg,Wallets,Baggit Women Purple Chata Hosh Wallet Purple
6015,6015.jpg,Topwear,Highlander Men Small Black Checked Shirt Black
35712,35712.jpg,Shoes,Nike Men Dual Fusion TR III Grey Sports Shoes Grey
51257,51257.jpg,Belts,Park Avenue Men Black & Brown Reversible Belt Black
21120,21120.jpg,Topwear,s.Oliver Men Solid Purple Sweater Purple
15315,15315.jpg,Shoes,ADIDAS Men Eqt Nitro Fashion Black Sports Shoes Black
4742,4742.jpg,Shoes,Numero Uno Women NY Grey Blue Shoe Grey
5690,5690.jpg,Shoes,Skechers Men Valence Envoy Black Shoe Synthetic Black
32537,32537.jpg,Fragrance,Playboy Men Hollywood Perfume 100 ml Black
56072,56072.jpg,Lips,Colorbar Wild Berry Lip Liner /Crayon 011 Brown
37879,37879.jpg,Socks,Happy Socks Unisex Black Socks Black
24452,24452.jpg,Shoes,Nike Men White Court Shuttle IV Sports Shoes White
4584,4584.jpg,Bags,Wildcraft Unisex Red Backpack Red
36351,36351.jpg,Ties,Reid & Taylor Men Blue Tie Blue
14001,14001.jpg,Topwear,Nike Men Solid Navy Blue Jerseys Navy Blue
20234,20234.jpg,Topwear,Wrangler Women Baroque Polo Turquoise T-shirt Blue
5456,5456.jpg,Bottomwear,Nike Men's Basic Woven Med Blue Short Navy Blue
37283,37283.jpg,Topwear,Tantra Women Brown Fight Peace T-shirt Brown
44771,44771.jpg,Shoes,Globalite Men Navy Blue Skid Shoes Grey
25746,25746.jpg,Belts,Lino Perros Men Leather Black Belt Black
11573,11573.jpg,Topwear,W Women Printed Green Kurtas Green
39319,39319.jpg,Bottomwear,Gini and Jony Boys Beige Shorts Beige
33623,33623.jpg,Wallets,Lino Perros Women Blue Wallet Blue
57366,57366.jpg,Innerwear,Amante Women Pink Lace Briefs PCFR11 Pink
24694,24694.jpg,Topwear,Locomotive Men Striped White T-shirt White
27011,27011.jpg,Bottomwear,Jealous 21 Women White Capris White
13224,13224.jpg,Topwear,Palm Tree Kids Boys Printed Blue Sweatshirts Blue
43554,43554.jpg,Socks,Puma Women Cream Socks Cream
28865,28865.jpg,Topwear,Proline Men Brown Striped Polo T-shirt Brown
2673,2673.jpg,Bags,Murcia Women Sleek Black Leatherette Hand Bag Black
31174,31174.jpg,Topwear,Gini and Jony Girls Red Top Red
8349,8349.jpg,Topwear,Doodle Boy's I love Driving Green Kidswear Green
55431,55431.jpg,Lips,Revlon True Red Colorburst Lipstick 090 Red
34406,34406.jpg,Topwear,Myntra Men Black Printed T-shirt Black
28059,28059.jpg,Innerwear,Jockey ELANCE Men Pack Of 2 Briefs 1010 Blue
48980,48980.jpg,Jewellery,Lucera Women Silver Ring Silver
17684,17684.jpg,Shoes,Catwalk Women Ballerina Grey Casual Shoe Synthetic Grey
31948,31948.jpg,Shoes,Nike Men Air Pegasus Blue Sports Shoes Blue
51091,51091.jpg,Free Gifts,Satya Paul Green Saree Green
22563,22563.jpg,Bags,Lino Perros Brown Women Casual Sling Bag Brown
7301,7301.jpg,Topwear,UCB Women Stripe Short Sleeve Blue White Top Blue
46026,46026.jpg,Jewellery,Estelle Women Gold Pendant with Chain Gold
30294,30294.jpg,Topwear,Myntra Men Global Response Off White T-shirt Off White
27223,27223.jpg,Dress,Doodle Kids Girl Printed Blue Dress Blue
13016,13016.jpg,Shoes,Inc 5 Women Casual Brown Wedges Brown
3593,3593.jpg,Shoes,Converse Unisex Black Casual Shoes Black
34634,34634.jpg,Shoes,Lotto Men Brown Fella Tres Shoes Brown
7133,7133.jpg,Bottomwear,Urban Yoga Men Bottom Grey Yoga Pants Grey
8947,8947.jpg,Bottomwear,Indigo Nation Men ID Printed Grey Trousers Grey
22751,22751.jpg,Topwear,BIBA Women Printed White Kurta White
52426,52426.jpg,Loungewear and Nightwear,Red Rose Women Blue Nightdress Blue
39917,39917.jpg,Bags,Tortoise Women Yellow Sling Bag Yellow
5664,5664.jpg,Topwear,Tantra Men's Shloka Blue T-shirt Blue
57968,57968.jpg,Saree,Prafful Rust Sari Rust
20006,20006.jpg,Topwear,United Colors of Benetton Women Printed Green T-shirt Green
41031,41031.jpg,Watches,Nautica Men Black Dial Watch Black
25574,25574.jpg,Shoes,FILA Men Trempet Black & White Sports Shoes Black
56086,56086.jpg,Lips,ColorBar Star Shine Chai Lip Gloss 07 Brown
11741,11741.jpg,Topwear,Lee Men Stripes Navy Blue T-shirt Navy Blue
10693,10693.jpg,Topwear,Doodle Girl Cute Purple Tops Purple
57154,57154.jpg,Topwear,Elle Women Grey Melange T-shirt Grey Melange
58920,58920.jpg,Accessories,Hakashi Men Combo pack Tie+Cufflink+Pocket square Maroon
19148,19148.jpg,Topwear,United Colors of Benetton Men Navy Blue Polo Tshirt Navy Blue
55267,55267.jpg,Makeup,Lakme Absolute Shine Line Olive Eye Liner Olive
26795,26795.jpg,Topwear,Arrow Men Blue Shirt Blue
31722,31722.jpg,Jewellery,Fabindia Women Anusuya Silver Earrings Silver
49638,49638.jpg,Topwear,Mineral Women Pink Top Pink
43302,43302.jpg,Dress,United Colors of Benetton Women Purple Dress Purple
2025,2025.jpg,Topwear,ADIDAS Mens Full Grey T-shirt Grey
13472,13472.jpg,Dress,United Colors of Benetton Women Solid White Dress White
7557,7557.jpg,Bottomwear,Nike Men's Tempo 5 Green Short Green
35382,35382.jpg,Shoes,Enroute Boys Grey Casual Shoes Grey
19974,19974.jpg,Topwear,United Colors of Benetton Women Yellow T-shirt Yellow
16100,16100.jpg,Eyewear,M tv Women My Fab Eyewear Maroon Sunglasses Maroon
50715,50715.jpg,Topwear,Doodle Boys White Printed T-Shirt White
6485,6485.jpg,Topwear,ADIDAS Men's Grey Strip T-shirt Grey
34250,34250.jpg,Bottomwear,Proline Charcoal Grey Shorts Charcoal
44127,44127.jpg,Fragrance,Boss Men In Motion Deo Grey
14657,14657.jpg,Bottomwear,Probase Men Solid DK.Grey Trousers Grey
33849,33849.jpg,Shoes,Puma Men Blue Shoes Blue
20462,20462.jpg,Bags,Baggit Women Auxi Baby Purple Mobile Pouch Purple
15785,15785.jpg,Innerwear,Facit Men Mid- Rise BF Black Briefs Black
52042,52042.jpg,Topwear,Just Natural Unisex Black Rain Jacket Black
36507,36507.jpg,Bags,United Colors of Benetton Women Grey Bag Grey
57530,57530.jpg,Shoes,Provogue Men Black Casual Shoes Black
33075,33075.jpg,Topwear,U.S.Polo Assn. Men Blue & Orange Striped T-shirt Blue
40587,40587.jpg,Topwear,Aurelia Women Brown Kurta Brown
41455,41455.jpg,Sandal,Lee Cooper Men Grey Sandals Grey
25110,25110.jpg,Belts,Lino Perros Women Olive Belts Olive
44315,44315.jpg,Bottomwear,Indian Terrain Men Blue Trousers Blue
36735,36735.jpg,Topwear,Spykar Women Cult Multi T-shirt Multi
21782,21782.jpg,Belts,Fossil Men Edsel Brown Belt Brown
59698,59698.jpg,Innerwear,Avirate Cream Fitted Camisoles Cream
33247,33247.jpg,Topwear,Arrow Men Grey Check Shirt Grey
57702,57702.jpg,Skin,Lotus Herbals Almond Anti-Wrinkle Creme White
25322,25322.jpg,Watches,Casio Edifice Men Chronograph Watch EF-550D-7AVDF(ED391) Metal Grey
11117,11117.jpg,Topwear,Indigo Nation Men Solid Grey Shirts Grey
41667,41667.jpg,Shoes,Catwalk Women Black Heels Black
32395,32395.jpg,Topwear,Arrow Woman Grey Shirt Grey
55055,55055.jpg,Lips,Lakme Enrich Satins Lipstick 131 Purple
12792,12792.jpg,Topwear,Nike Men Manchester United Black Jersey Black
27475,27475.jpg,Innerwear,Jockey Women White Essence Bra 2001 White
13640,13640.jpg,Shoes,Carlton London Women Purple Flat Shoes Purple
54187,54187.jpg,Innerwear,Jockey MC Men Grey Pack of 2 Briefs 8003 Charcoal
43130,43130.jpg,Fragrance,David Beckham Women Signature Eau De Toilette 50 ml Purple
2217,2217.jpg,Socks,ADIDAS Women Pink Socks Pink
16332,16332.jpg,Topwear,Peter England Men Stripes Red Shirt Red
55869,55869.jpg,Nails,Colorbar All Fired Up 2 Nail Lacquer 83V Red
46442,46442.jpg,Watches,Timex Men Silver Dial Watch Silver
47590,47590.jpg,Shoes,Portia Women Green Sandals Green
34062,34062.jpg,Dress,Gini and Jony Girls Printed Pink Dress Pink
50527,50527.jpg,Innerwear,Chromozome Men Navy Blue Pack of 2 Briefs Navy Blue
59005,59005.jpg,Fragrance,Brut Men Musk Deo Black
56871,56871.jpg,Shoes,HM Women Black Sandals Black
44588,44588.jpg,Topwear,Scullers Men White & Navy Blue Check Shirt White
32508,32508.jpg,Sandal,Franco Leone Men Brown Sandals Brown
59839,59839.jpg,Fragrance,Valley of Flowers Women Fragrance Gift Set Maroon
21923,21923.jpg,Topwear,BIBA Women Printed Black Kurta Black
36994,36994.jpg,Bags,Lino Perros Women Brown Handbag Brown
10658,10658.jpg,Topwear,Doodle Girl Little frock White Tops White
40128,40128.jpg,Topwear,Gini and Jony Girls Roseatte Orange Top Orange
38032,38032.jpg,Watches,Q&Q Women Black Watch Black
9062,9062.jpg,Topwear,Mark Taylor Men Pink Striped Shirt Pink
48345,48345.jpg,Jewellery,Pitaraa Golden Nugget Long Necklace Gold
18435,18435.jpg,Accessories,Vital Gear Unisex Black Messenger Bag Black
6816,6816.jpg,Shoes,Timberland Men's Desert Walnut Brown Shoe Brown
3558,3558.jpg,Shoes,Skechers Men's Brown Casual Lifestyle Shoe Synthetic Brown
23648,23648.jpg,Topwear,Disney Men Maroon Printed T-shirt Maroon
12933,12933.jpg,Topwear,Classic Polo Men Broad Stripes Green Tshirts Green
54528,54528.jpg,Shoes,F Sports Men White Charger Shoes White
18607,18607.jpg,Wallets,New Hide Men Antique Brown Wallet Brown
9250,9250.jpg,Topwear,Mark Taylor Men Red Striped Shirt Red
48177,48177.jpg,Wallets,Fossil Women Blue Wallet Blue
8382,8382.jpg,Topwear,Doodle Girl's Raw Edges Light Blue Kidswear Blue
50188,50188.jpg,Bags,Paridhan Women Pink Handbag Pink
30851,30851.jpg,Topwear,Fabindia Women Printed Green Kurta Green
28092,28092.jpg,Innerwear,Jockey GOLDEDN Men Gold Edition White Innerwear Vest 4020 White
49899,49899.jpg,Watches,Q&Q Kids Girls White Dial Analog Watch White
29140,29140.jpg,Eyewear,Vogue Women Purple Sunglasses Purple
31983,31983.jpg,Bags,ADIDAS Men Black Bag Black
26934,26934.jpg,Dress,Jealous 21 Women Black Dress Black
45668,45668.jpg,Fragrance,Swiss Army Men Swiss Unlimited Rubber EDT Refillable Perfumes White
15118,15118.jpg,Bottomwear,Arrow Men Stripes Black Trousers Black
59237,59237.jpg,Watches,Titan Men Black Dial Watch Black
1801,1801.jpg,Bags,Quechua Women 10L Pink Bag Pink
37248,37248.jpg,Shoes,United Colors of Benetton Men Brown Shoes Brown
15924,15924.jpg,Bags,ADIDAS Unisex Ecb Black Backpack Black
38200,38200.jpg,Eyewear,Polaroid Men Sunglasses Black
42029,42029.jpg,Shoes,ADIDAS Women Purple Chill Sports Shoes Purple
12759,12759.jpg,Bottomwear,Spykar Women Washed Blue Jeans Blue
35947,35947.jpg,Topwear,Flying Machine Men White Shirt White
18263,18263.jpg,Topwear,Aneri Women Nancy Yellow Kurta Yellow
9634,9634.jpg,Topwear,Indigo Nation Men Price catch Black White Shirts White
48513,48513.jpg,Topwear,French Connection Women Black Top Black
23822,23822.jpg,Flip Flops,Puma Men Breeze Red Flip Flops Red
29524,29524.jpg,Watches,Playboy Women White Dial Watch White
42815,42815.jpg,Innerwear,Little Miss Intimates Women Green Brief Green
46489,46489.jpg,Watches,Timex Men Blue Dial Watch Blue
54970,54970.jpg,Free Gifts,Rasasi Women Body Lotion Pink
53369,53369.jpg,Bags,Puma Women Black Bag Black
10832,10832.jpg,Topwear,Wrangler Men American Music Folk Green T-Shirts Green
59653,59653.jpg,Saree,FNF Green & Pink Evening Wear Sari Green
38664,38664.jpg,Shoes,Nike Men Liteforce Grey Shoes Grey
4917,4917.jpg,Topwear,Gini and Jony Girl's Vollie Pink Kidswear Pink
24835,24835.jpg,Shoes,Rockport Men Brown Cashaw Camel Suede Casual Shoes TPR Brown
33882,33882.jpg,Watches,Citizen Men Black Dial Eco-Drive Watch Black
59461,59461.jpg,Jewellery,Lucera Silver Ring Silver
32950,32950.jpg,Shoes,ADIDAS Neo Unisex Court Sequence Black Shoes Black
52089,52089.jpg,Topwear,Myntra Women Black T-shirt Black
4319,4319.jpg,Topwear,Tantra Kid's Unisex Free Spirit Turquoise Kidswear Blue
38456,38456.jpg,Bags,Baggit Women Orange Tinki Tower Sling Bag Orange
39584,39584.jpg,Shoes,Catwalk Women Black Heels Black
56429,56429.jpg,Eyes,Streetwear Bombshell Eye Shadow Brown
45802,45802.jpg,Shoes,Senorita Women Black Flats Black
19183,19183.jpg,Topwear,United Colors of Benetton Men Check Grey Shirt Grey
9406,9406.jpg,Topwear,Puma Men Scribble Graphic Black Tshirts Black
17825,17825.jpg,Sandal,Nike Unisex Air Deschutz Black Sandal Black
48721,48721.jpg,Jewellery,Lucera Women Silver Earrings Silver
18051,18051.jpg,Wallets,Lino Perros Women Solid Black Wallet Black
3900,3900.jpg,Topwear,Disney Kids Girl Pooh Pink And White Top Pink
17019,17019.jpg,Shoes,Rocia Women Casual Brown Sandal Brown
49435,49435.jpg,Shoes,Vans Men Blue Shoes Blue
8712,8712.jpg,Eyewear,Fastrack Unisex Black Sunglasses Black
26598,26598.jpg,Shoes,Puma Men Faas 300 White Sports Shoes White
19345,19345.jpg,Wallets,Reid&Taylor Men Solid Brown Wallet Brown
18297,18297.jpg,Topwear,Aneri Women Kaalki Multi Coloured Kurta Multi
34861,34861.jpg,Shoes,Vans Men Era Grey Shoes Grey
2228,2228.jpg,Socks,ADIDAS Men Black Socks Black
22138,22138.jpg,Shoes,Provouge Men Black Classic Formal Shoe Black
55856,55856.jpg,Nails,Colorbar Pro Rosie Nail Lacquer 015 Red
6688,6688.jpg,Topwear,UCB Women's V Neck Black T-shirt Black
54984,54984.jpg,Loungewear and Nightwear,Femella Women Printed Blue Lounge Pants Blue
50518,50518.jpg,Innerwear,Chromozome Men Black Innerwear Vest Black
28402,28402.jpg,Eyewear,Idee Women Brown Sunglasses Brown
43933,43933.jpg,Shoes,Catwalk Women Black Heels Black
11914,11914.jpg,Sandal,Franco Leone Men Casual Black Sandals Rubber Black
15588,15588.jpg,Topwear,Spykar Men Striped Blue Shirt Blue
33278,33278.jpg,Bottomwear,Gini and Jony Boys Washed Blue Jeans Blue
5831,5831.jpg,Topwear,Puma Men's Cbn Logo Black T-Shirt Black
11128,11128.jpg,Bottomwear,Urban Yoga Men Solid Beige Track Pants Beige
39742,39742.jpg,Shoes,Arrow Men Red Shoes Red
44118,44118.jpg,Fragrance,Hugo Men Just Different 150 ml Perfume Black
58547,58547.jpg,Eyewear,Miami Blues Women Sunglasses Plastic Black
14668,14668.jpg,Topwear,Basics Men White Slim Fit Checked Shirt White
33876,33876.jpg,Watches,Citizen Men Black Dial Chronograph Watch Black
36538,36538.jpg,Wallets,United Colors of Benetton Women Blue Wallet Blue
25913,25913.jpg,Bottomwear,Femella Women Blue Leggings Blue
44924,44924.jpg,Bottomwear,Jack & Jones Men Blue Jeans Blue
39570,39570.jpg,Shoes,Catwalk Women Black Heels Black
32198,32198.jpg,Topwear,Fabindia Men Printed Grey Kurta Grey
52841,52841.jpg,Jewellery,Adrika Green Earrings Green
19177,19177.jpg,Topwear,United Colors Of Benetton Men Navy Blue Shirt Navy Blue
55258,55258.jpg,Makeup,Lakme Absolute Forever Silk Blue Cosmos Eye Liner Blue
49607,49607.jpg,Shoes,Catwalk Women Brown Heeled Shoes Brown
16903,16903.jpg,Topwear,Status Quo Men Solid Dark Grey Sweatshirt Grey
8520,8520.jpg,Bags,Nike Women Nike Grey handbag Grey Bags Grey
27678,27678.jpg,Bags,Murcia Women Brown Handbag Brown
7568,7568.jpg,Topwear,Nike Men's Black Polo T-shirt Black
2826,2826.jpg,Shoes,Lee Cooper Men Leather Semi Formal Brown Shoe Brown
28630,28630.jpg,Bottomwear,Nike Men Pintuck Grey Track Pants Grey
18899,18899.jpg,Topwear,Arrow Woman Igor Maroon Top Maroon
52419,52419.jpg,Loungewear and Nightwear,Red Rose Women Coffee Brown Nightdress Coffee Brown
41832,41832.jpg,Shoes,Skechers Men Black Sneakers Black
4789,4789.jpg,Topwear,ADIDAS Men's Demon Grey T-shirt Grey
56885,56885.jpg,Shoes,HM Women Red Heels Red
57957,57957.jpg,Saree,Prafful Multi Coloured Sari Multi
20039,20039.jpg,Bottomwear,United Colors of Benetton Women Olive Floral Design Tights Olive
58123,58123.jpg,Jewellery,Rreverie Silver & White Earrings Silver
24499,24499.jpg,Topwear,Mother Earth Women Green Printed Kurta Green
20805,20805.jpg,Flip Flops,Fila Men Rambler Olive Flip Flops Olive
9096,9096.jpg,Shoes,Converse Unisex Ct As Star Chevron Hi Blue Casual Shoes Blue
43759,43759.jpg,Jewellery,Royal Diadem Black Earrings Gold
7930,7930.jpg,Topwear,Proline Men Black Polo T-shirt Black
19513,19513.jpg,Wallets,Wrangler Leather Men Brown Wallets Brown
8144,8144.jpg,Watches,Fastrack Women Economy Analog Red Black Watch Red
17489,17489.jpg,Shoes,Rockport Women Beige Flats Off White
28254,28254.jpg,Fragrance,Wild Stone Men Forest Spice Deo Green
13815,13815.jpg,Topwear,Proline Pack of 3 Printed T-shirts Grey
8978,8978.jpg,Shoes,Puma Women Saba Ballet DC3 Purple Casual Shoes Purple
48183,48183.jpg,Bags,Fossil Women Brown Handbag Brown
29988,29988.jpg,Watches,Aspen Women Mother Of Pearl Dial Watch AP1193 Metal White
51892,51892.jpg,Wallets,Nyk Women Mushroom Brown Wallet Mushroom Brown
8376,8376.jpg,Bags,Fastrack Men Black Backpack Black
46825,46825.jpg,Shoes,Catwalk Women Off-White and Blue Pumps Synthetic Off White
19721,19721.jpg,Topwear,United Colors Of Benetton Men Grey Shirt Grey
34439,34439.jpg,Topwear,Myntra Women Explorer White T-shirt White
27812,27812.jpg,Belts,Bulchee Men Black & Brown Reversible Belt Black
28066,28066.jpg,Innerwear,Jockey ELANCE Mens Grey Melange Trunks 1015 Grey Melange
16769,16769.jpg,Bags,Spice Art Women Shimmer Silver Clutch Silver
31977,31977.jpg,Shoes,Nike Women Lunarswift +3 Olive Sports Shoes Olive
46019,46019.jpg,Topwear,Fabindia Women White Printed Kurta White
58311,58311.jpg,Socks,Jockey LCESCBRA Men Pack of 3 Socks 2004 Black
5469,5469.jpg,Shoes,Nike Men's Nike Streetgato Black Shoe Black
25779,25779.jpg,Topwear,Arrow Men Black Suspenders Black
39326,39326.jpg,Bottomwear,Gini and Jony Girls Black Leggings Black
14802,14802.jpg,Bags,United Colors of Benetton Women Solid Maroon Handbags Maroon
57359,57359.jpg,Innerwear,Amante Black Printed Full-Coverage Bra BGSW01 Black
5638,5638.jpg,Flip Flops,ADIDAS Men's Adi Liner Brown Flip Flop Brown
57934,57934.jpg,Sandal,Clarks Men Brown Sandals Brown
